ticker,headline,source,date,polarity_score,sentiment,vader_score,vader_sentiment
AMZN,"Pega expands AI platform with agent orchestration, development tools and new pricing model",SiliconANGLE News,2026-06-08T15:30:06Z,0.13636363636363635,Positive,0.1027,Positive
AMZN,"Is Amazon.com, Inc. (AMZN) A Good Stock To Buy Now?",Yahoo Entertainment,2026-06-08T15:25:48Z,0.7,Positive,0.4404,Positive
AMZN,Is Apple Inc. (AAPL) A Good Stock To Buy Now?,Yahoo Entertainment,2026-06-08T15:19:57Z,0.7,Positive,0.4404,Positive
AMZN,J-B Weld PlasticWeld Quick-Setting Epoxy Syringe for $5 + free shipping w/ Prime,Dealnews.com,2026-06-08T15:19:09Z,0.4,Positive,0.5106,Positive
AMZN,Food Decision Dice for $2 + free shipping w/ Prime,Dealnews.com,2026-06-08T15:17:04Z,0.4,Positive,0.5106,Positive
AMZN,Electric Toilet Brush for $7 + free shipping w/ Prime,Dealnews.com,2026-06-08T15:15:07Z,0.18333333333333335,Positive,0.5106,Positive
AMZN,Alphabet GOOG Stock 2026 Outlook: Strong AI Momentum Makes It a Buy for Long-Term Investors,Ibtimes.com.au,2026-06-08T14:50:30Z,0.43333333333333335,Positive,0.5106,Positive
AMZN,"18.1"" 3D Hologram Fan for $54.50 + free shipping",Dealnews.com,2026-06-08T14:41:34Z,0.4,Positive,0.6808,Positive
AMZN,Bell Global Equities Fund Bets on MercadoLibre (MELI) Amid Weakness,Yahoo Entertainment,2026-06-08T14:37:05Z,0.0,Neutral,-0.4215,Negative
AMZN,The Math on SpaceX’s IPO Is Virtually Impossible,Futurism,2026-06-08T14:37:00Z,-0.6666666666666666,Negative,0.0,Neutral
AMZN,Redsack 5-in-1 Electric Wine Decanter and Smart Liquor Dispenser for $47 + free shipping,Dealnews.com,2026-06-08T14:26:29Z,0.30714285714285716,Positive,0.7184,Positive
AMZN,Heads up: Early Prime Day deal now live on AirPods Pro 3 down at $199 via Amazon,9to5Toys,2026-06-08T14:19:00Z,0.026936026936026935,Positive,0.1779,Positive
AMZN,AstroAI Pressure Washer Gun w/ 4 Nozzles for $25 + free shipping w/ Prime,Dealnews.com,2026-06-08T14:13:47Z,0.4,Positive,-0.0772,Negative
AMZN,AstroAI Pressure Washer Gun w/ 4 Nozzles for $25 + free shipping w/ Prime,Dealnews.com,2026-06-08T14:13:47Z,0.4,Positive,-0.0772,Negative
AMZN,Isolation of bioactive compounds from the petroleum ether soluble fraction of Eichhornia crassipes (Mart.) Solms flowers with dual evaluation: In silico studies of isolated molecules and in vitro/in vivo activities of the extract,Plos.org,2026-06-08T14:00:00Z,0.0,Neutral,-0.6124,Negative
AMZN,Is Prime Day the best time to buy a TV?,Business Insider,2026-06-08T13:57:28Z,1.0,Positive,0.6369,Positive
AMZN,Looking to tackle wrinkles? This ELEMIS serum is 20% off before Prime Day,New York Post,2026-06-08T13:55:00Z,0.0,Neutral,0.0,Neutral
AMZN,Apple investors pin hopes on WWDC AI overhaul to ignite next stock surge,Macdailynews.com,2026-06-08T13:52:56Z,0.0,Neutral,0.4215,Positive
AMZN,"I didn’t expect this Shark blow dryer deal before Prime Day, but here we are",New York Post,2026-06-08T13:41:52Z,0.0,Neutral,0.0,Neutral
AMZN,Homyhomey Leather Accent Chair for $44.50 in cart + free shipping,Dealnews.com,2026-06-08T13:37:17Z,0.4,Positive,0.5106,Positive
AMZN,Xiaomi 17T review: Value smartphone done right,The Times of India,2026-06-08T13:35:04Z,0.2857142857142857,Positive,0.34,Positive
AMZN,House Again Bristle-Free Grill Brush with Scraper for $15 + free shipping w/ Prime,Dealnews.com,2026-06-08T13:25:30Z,0.4,Positive,0.5106,Positive
AMZN,Make up for the headaches you gave him with this ‘relaxing’ $60 Father’s Day find,New York Post,2026-06-08T13:22:48Z,0.0,Neutral,0.0,Neutral
AMZN,Amazon’s billion-dollar Corning deal shows fibre is the new bottleneck in the AI build-out,The Next Web,2026-06-08T13:18:15Z,0.13636363636363635,Positive,0.0,Neutral
AMZN,"TQQQ Turned $10,000 Into $353,789, but Friday’s 14% Crash Shows Leverage Cuts Both Ways",24/7 Wall St.,2026-06-08T13:14:23Z,0.0,Neutral,-0.7469,Negative
AMZN,Celebeauty 110000 RPM Hair Dryer Blow Dryer for $33 + free shipping w/ Prime,Dealnews.com,2026-06-08T13:12:05Z,0.4,Positive,0.5106,Positive
AMZN,Viltrox AF 75mmF1.8 and 90mmF2.2 EVO Lenses Available Now – First Reviews,Fujirumors.com,2026-06-08T13:01:44Z,0.325,Positive,0.0,Neutral
AMZN,Cerebras shares climb as Wall Street brokerages back AI chip strategy,The Times of India,2026-06-08T12:53:26Z,0.0,Neutral,0.296,Positive
AMZN,"Bates Choice 7"" Nail Puller for $9 + free shipping w/ Prime",Dealnews.com,2026-06-08T12:47:59Z,0.4,Positive,0.5106,Positive
AMZN,SpaceX Has a Plan for AI That Sounds Like Pure Science Fiction. How It Impacts Your Wealth,24/7 Wall St.,2026-06-08T12:44:37Z,0.21428571428571427,Positive,0.6908,Positive
AMZN,Nexera Technologies: Subsidiary Fort Technology Commences Trading on Nasdaq Under Ticker “FRTT” Today,GlobeNewswire,2026-06-08T12:36:00Z,0.0,Neutral,0.0,Neutral
AMZN,Amazon strikes multibillion-dollar deal with Corning to power AI data centers in U.S.,CNBC,2026-06-08T12:35:01Z,0.0,Neutral,-0.2023,Negative
AMZN,Kitsure Bamboo Cutting Board for $10 + free shipping w/ Prime,Dealnews.com,2026-06-08T12:32:43Z,-0.09999999999999998,Negative,0.4215,Positive
AMZN,Little Giant 115V Automatic Condensate Removal Pump for $51 + free shipping,Dealnews.com,2026-06-08T12:29:45Z,0.07083333333333335,Positive,0.5106,Positive
AMZN,Dominator Mulch Anchor 1-Gal. Mulch Glue & Gravel Binder for $44 via Sub. & Save + free shipping,Dealnews.com,2026-06-08T12:25:11Z,0.4,Positive,0.7184,Positive
AMZN,Easy Lunch Idea! Kraft Easy Mac Microwavable Macaroni & Cheese ( Pack of 18) {Amazon} | 25¢ a Pack,Livingrichwithcoupons.com,2026-06-08T12:15:04Z,0.48750000000000004,Positive,0.7263,Positive
AMZN,What is agentic commerce? A peek into the future of buying (with caveats),Yoast.com,2026-06-08T11:55:36Z,0.0,Neutral,0.0,Neutral
AMZN,Double-Sided Multipurpose Cloth 12-Pack for $4 + free shipping w/ Prime,Dealnews.com,2026-06-08T11:50:04Z,0.4,Positive,0.5106,Positive
AMZN,Flush 'n Sparkle Cartridge Refill 2-Pack for $11 + free shipping w/ Prime,Dealnews.com,2026-06-08T11:46:32Z,0.4,Positive,0.7269,Positive
AMZN,The Making of Middle-Earth: The Worlds of Tolkien and The Lord of the Rings Hardcover Book for $14 w/ Prime + free shipping,Dealnews.com,2026-06-08T11:32:59Z,0.4,Positive,0.5106,Positive
AMZN,Tools & Home Improvement Early Prime Day Deals at Amazon: Up to 50% off + free shipping w/ Prime,Dealnews.com,2026-06-08T11:21:37Z,0.25,Positive,0.7906,Positive
AMZN,Coloer Low Voltage Landscape Lighting Kit 8-Pack for $43 w/ Prime + free shipping,Dealnews.com,2026-06-08T11:20:29Z,0.2,Positive,0.296,Positive
AMZN,"Vulnerability Summary for the Week of June 1, 2026",Cisa.gov,2026-06-08T11:15:41Z,0.0,Neutral,-0.2263,Negative
AMZN,Furniture and Mattresses Early Prime Day Deals at Amazon: Up to 35% off + free shipping w/ Prime,Dealnews.com,2026-06-08T11:09:12Z,0.25,Positive,0.6124,Positive
GOOGL,OpenAI joins rival Anthropic in race to Wall Street,The Times of India,2026-06-09T01:18:20Z,0.0,Neutral,0.0,Neutral
GOOGL,OpenAI files for US IPO after Anthropic as AI giants head to public markets,The Times of India,2026-06-09T01:17:50Z,0.0,Neutral,0.0,Neutral
GOOGL,"Google upgrades NotebookLM to Gemini 3.5, adds more coding features",SiliconANGLE News,2026-06-09T00:49:22Z,0.5,Positive,0.0,Neutral
GOOGL,"OpenAI IPO: ChatGPT maker files for US Stock Market initial public offering after Anthropic, SpaceX",The Times of India,2026-06-09T00:10:00Z,0.0,Neutral,0.0,Neutral
GOOGL,Tech giant OpenAI files for US initial public offering,Al Jazeera English,2026-06-08T22:23:40Z,0.0,Neutral,0.0,Neutral
GOOGL,OpenAI Files For U.S. IPO After Anthropic As AI Giants Head To Public Markets,HuffPost,2026-06-08T22:00:58Z,0.0,Neutral,0.0,Neutral
GOOGL,OpenAI files for US IPO after Anthropic as AI giants head to public markets,CNA,2026-06-08T21:17:00Z,0.0,Neutral,0.0,Neutral
GOOGL,Cipher Digital raises $810 million in junk bonds to build another Amazon data centre in Texas,The Next Web,2026-06-08T20:18:03Z,0.0,Neutral,0.1779,Positive
GOOGL,"US stocks: S&P 500, Nasdaq end up as tech, chipmakers rebound",The Times of India,2026-06-08T20:02:24Z,0.0,Neutral,0.0,Neutral
GOOGL,SpaceX’s $75 billion IPO is well oversubscribed as order books close ahead of Wednesday pricing,The Next Web,2026-06-08T17:39:38Z,0.0,Neutral,0.2732,Positive
GOOGL,The gravity of the SpaceX IPO,Freerepublic.com,2026-06-08T17:23:12Z,0.0,Neutral,0.0,Neutral
GOOGL,Intel gains on report that Google will use it to make chips,Financial Post,2026-06-08T16:30:31Z,0.0,Neutral,0.34,Positive
GOOGL,"Apple stock price prediction after WWDC 2026: With Apple (AAPL) trading near its all-time high of $302.25, will AI-powered Siri drive the stock above $400?",The Times of India,2026-06-08T16:19:14Z,0.08666666666666667,Positive,0.0,Neutral
GOOGL,Alphabet GOOG Stock 2026 Outlook: Strong AI Momentum Makes It a Buy for Long-Term Investors,Ibtimes.com.au,2026-06-08T14:50:30Z,0.43333333333333335,Positive,0.5106,Positive
GOOGL,Alphabet taps company veteran for principal accounting post,CFO Dive,2026-06-08T14:27:24Z,0.0,Neutral,0.0,Neutral
GOOGL,"U.S. Stock Market prediction for Monday: Nasdaq, S&P 500, Dow Jones crash to continue in Wall Street? These factors will determine",The Times of India,2026-06-08T01:32:42Z,0.0,Neutral,-0.4019,Negative
GOOGL,Alberto Romero on Apple’s AI Spending,Thealgorithmicbridge.com,2026-06-08T00:55:56Z,0.0,Neutral,0.0,Neutral
GOOGL,SpaceX’s IPO will also be a massive selling event triggering big price dislocations across the stock market as investors dump shares to buy SPCX,Fortune,2026-06-07T20:39:06Z,0.0,Neutral,-0.1027,Negative
GOOGL,SpaceX’s IPO will also be a massive selling event triggering big price dislocations across the stock market as investors dump shares to buy SPCX,Yahoo Entertainment,2026-06-07T20:39:06Z,0.0,Neutral,-0.1027,Negative
GOOGL,Bill Maher’s New Rule: How the kids must “fix” AI,Whyevolutionistrue.com,2026-06-07T16:15:27Z,0.13636363636363635,Positive,0.0,Neutral
GOOGL,"AIQ Turned $10,000 Into $13,400 in Six Months as AI Chips Soared 34% YTD",24/7 Wall St.,2026-06-07T11:00:06Z,0.0,Neutral,0.0,Neutral
GOOGL,I spent years investing into Google’s ecosystem — and now I’m regretting it,Android Authority,2026-06-07T10:30:41Z,-0.1,Negative,-0.4019,Negative
GOOGL,Meta weighs raising tens of billions in stock offering after Google deal,Crypto Briefing,2026-06-07T05:39:00Z,0.0,Neutral,0.0,Neutral
GOOGL,Rupee hits 96 against USD: How can falling currency impact your investments and how to protect them?,Livemint,2026-06-07T02:30:19Z,0.0,Neutral,0.25,Positive
GOOGL,Fed's Mary Daly has blunt message for AI stock investors,TheStreet,2026-06-06T19:13:00Z,0.0,Neutral,0.0,Neutral
GOOGL,Piper Sandler Raises PT on Alphabet (GOOGL) Stock,Yahoo Entertainment,2026-06-06T17:24:37Z,0.0,Neutral,0.0,Neutral
GOOGL,Jim Cramer Believes “Alphabet Could Raise Serious Money”,Yahoo Entertainment,2026-06-06T15:05:57Z,-0.3333333333333333,Negative,-0.0772,Negative
GOOGL,Warren Buffett's Berkshire triples stake in newspaper giant,TheStreet,2026-06-06T14:37:00Z,0.0,Neutral,0.0,Neutral
GOOGL,"Meta, Google Could Be Among Winners As FCC Proposes New Undersea Cable Rules Targeting China Risk",Yahoo Entertainment,2026-06-06T14:31:26Z,0.13636363636363635,Positive,0.25,Positive
GOOGL,"Abel goes his own way with new Berkshire investments, including billions for AI",CNBC,2026-06-06T12:31:02Z,0.36818181818181817,Positive,0.0,Neutral
GOOGL,Google will pay SpaceX $920 million a month for AI compute as Musk turns a data centre built for Grok into a cash machine,The Next Web,2026-06-06T09:23:50Z,0.0,Neutral,-0.1027,Negative
GOOGL,Alphabet Stock vs Microsoft Stock: Which Stock To Buy in 2026?,Ibtimes.com.au,2026-06-06T08:03:06Z,0.0,Neutral,0.0,Neutral
GOOGL,Wall Street suffers worst hit of 2026 so far amid massive stock sell-off,ABC News (AU),2026-06-06T01:16:29Z,-0.375,Negative,-0.802,Negative
GOOGL,Google Agrees to Pay SpaceX $920 Million Monthly for AI Compute,pymnts.com,2026-06-06T00:13:56Z,0.0,Neutral,0.1027,Positive
GOOGL,"S&P 500 sees $1.8 trillion wipeout, Nasdaq tallies biggest point drop on record: What investors need to know about Friday’s selloff",MarketWatch,2026-06-05T22:27:00Z,0.0,Neutral,-0.2732,Negative
GOOGL,What Is The Biggest Threat To Google Stock?,Trefis,2026-06-05T20:07:03Z,0.0,Neutral,-0.5267,Negative
GOOGL,Google will pay SpaceX $920M per month for compute | TechCrunch,TechCrunch,2026-06-05T18:57:20Z,0.0,Neutral,-0.1027,Negative
GOOGL,Apple's WWDC: Tim Cook's AI legacy at stake in his final developer conference as CEO,CNBC,2026-06-05T16:59:20Z,0.0,Neutral,0.0,Neutral
GOOGL,Barchart’s Expert Stock Screener Explains Everything You Need to Know About Options Trading,Barchart.com,2026-06-05T16:37:50Z,0.0,Neutral,0.0,Neutral
GOOGL,Citi revisits Broadcom stock price target after post-earnings selloff,TheStreet,2026-06-05T15:52:25Z,0.0,Neutral,0.0,Neutral
GOOGL,Jim Cramer Highlights Alphabet’s Expensive New Capital Needs,Yahoo Entertainment,2026-06-05T14:14:16Z,-0.18181818181818182,Negative,0.0,Neutral
GOOGL,"After filing for its IPO, Anthropic says AI should slow down. Fat chance.",SiliconANGLE News,2026-06-05T14:00:33Z,-0.2277777777777778,Negative,0.25,Positive
GOOGL,Alphabet is seeking fresh capital as stock's 4-week losing streak tests investor appetite,CNBC,2026-06-05T12:00:01Z,0.3,Positive,-0.0772,Negative
GOOGL,Do We Need Billionaires?,Bjhess.com,2026-06-05T11:34:43Z,0.0,Neutral,0.0,Neutral
GOOGL,Why Broadcom (AVGO) Shares Are Trading Lower Today - Yahoo Finance,Slashdot.org,2026-06-05T11:12:45Z,0.0,Neutral,0.0,Neutral
GOOGL,Silicon Valley’s Biggest Payday. Yet!,Om.co,2026-06-05T05:45:00Z,0.0,Neutral,0.0,Neutral
GOOGL,AI companies are barreling toward huge Wall Street debuts. A look at the biggest players,Japan Today,2026-06-04T21:56:59Z,0.39999999999999997,Positive,0.3182,Positive
GOOGL,Warren Buffett successor Greg Abel leads Berkshire Hathaway $10B Alphabet stock investment—Why is Big Tech shift accelerating now?,The Times of India,2026-06-04T21:09:28Z,0.0,Neutral,0.2263,Positive
GOOGL,"Wall Street Analyst: Broadcom’s Flat AI Guidance Justified the Selloff, but Nvidia Remains Best-in-Class Chip Play",24/7 Wall St.,2026-06-04T20:18:56Z,0.1875,Positive,0.6059,Positive
GOOGL,AI Spending Has Been Huge. Now It Could Be Entering a 'Rational' Phase. Is That Good for Markets?,Investopedia,2026-06-04T16:56:39Z,0.5499999999999999,Positive,0.6369,Positive
GOOGL,What Suno’s $5.4 billion valuation says about the future of AI and music—and what remains uncertain,Fortune,2026-06-04T16:40:56Z,0.0,Neutral,-0.296,Negative
GOOGL,Prediction: Google Stock Will Hit $600 on This Date,24/7 Wall St.,2026-06-04T14:45:20Z,0.0,Neutral,0.0,Neutral
GOOGL,"Eightco Holdings (NASDAQ: ORBS) Reports Total Holdings of Approximately $437 Million, Includes OpenAI, Beast Industries, More Than 16,000 ETH and Over 283 Million WLD Tokens",PRNewswire,2026-06-04T12:30:00Z,0.033333333333333326,Positive,0.0,Neutral
GOOGL,"Eightco Holdings (NASDAQ: ORBS) Reports Total Holdings of Approximately $437 Million, Includes OpenAI, Beast Industries, More Than 16,000 ETH and Over 283 Million WLD Tokens",PR Newswire UK,2026-06-04T12:30:00Z,0.033333333333333326,Positive,0.0,Neutral
GOOGL,Is Alphabet Stock Underperforming the Nasdaq?,Barchart.com,2026-06-04T12:03:07Z,0.0,Neutral,0.0,Neutral
GOOGL,Alphabet raises $84.75B in upsized equity offering to fund massive AI buildout,Crypto Briefing,2026-06-04T08:13:35Z,0.0,Neutral,0.0,Neutral
GOOGL,"Ark Invest buys 267,582 shares of Google in $96M bet on Alphabet’s AI future",Crypto Briefing,2026-06-04T07:50:36Z,0.0,Neutral,0.296,Positive
GOOGL,AI companies are barreling toward huge Wall Street debuts. A look at the biggest players,Midland Reporter-Telegram,2026-06-04T05:32:22Z,0.39999999999999997,Positive,0.3182,Positive
GOOGL,AI companies are barreling toward huge Wall Street debuts. A look at the biggest players,WPLG Local 10,2026-06-04T05:31:04Z,0.39999999999999997,Positive,0.3182,Positive
GOOGL,AI companies are barreling toward huge Wall Street debuts. A look at the biggest players,The Times of India,2026-06-04T04:40:58Z,0.39999999999999997,Positive,0.3182,Positive
GOOGL,AI companies are barreling toward huge Wall Street debuts. A look at the biggest players,Abcnews.com,2026-06-04T04:29:30Z,0.39999999999999997,Positive,0.3182,Positive
GOOGL,AI companies are barreling toward huge Wall Street debuts. A look at the biggest players,Abcnews.com,2026-06-04T04:26:34Z,0.39999999999999997,Positive,0.3182,Positive
GOOGL,AI companies are barreling toward huge Wall Street debuts. A look at the biggest players,Abcnews.com,2026-06-04T04:25:04Z,0.39999999999999997,Positive,0.3182,Positive
GOOGL,Google's AI race gets costlier as Alphabet upsizes equity raise to $84.75 billion,Livemint,2026-06-04T03:26:58Z,0.0,Neutral,0.0,Neutral
GOOGL,Warren Buffett's Berkshire Hathaway doubles down on Google,TheStreet,2026-06-03T23:17:00Z,-0.15555555555555556,Negative,0.0,Neutral
GOOGL,Alphabet raises $85B in equity offering to fund AI ambitions,Crypto Briefing,2026-06-03T23:11:26Z,0.0,Neutral,0.0,Neutral
GOOGL,Google parent Alphabet raises AI funding target to $84.75 billion in massive equity offering,Crypto Briefing,2026-06-03T22:02:10Z,0.0,Neutral,0.0,Neutral
GOOGL,"Alphabet just raised $85 billion for AI, smashing the largest equity offering in history",The Next Web,2026-06-03T21:14:56Z,0.0,Neutral,0.0,Neutral
GOOGL,UK orders Google to provide AI Overviews opt-out option for publishers,SiliconANGLE News,2026-06-03T20:50:03Z,0.0,Neutral,0.0,Neutral
GOOGL,Alphabet Increases Record-Breaking Stock Offering to Feed AI Demand,pymnts.com,2026-06-03T19:43:06Z,0.0,Neutral,-0.128,Negative
GOOGL,Alphabet's record-breaking $85B raise for Google's AI business is a helluva good signal | TechCrunch,TechCrunch,2026-06-03T19:40:43Z,0.7,Positive,0.4404,Positive
GOOGL,Google raises $80 billion in equity offering with Berkshire Hathaway’s backing,Crypto Briefing,2026-06-03T18:54:21Z,0.0,Neutral,0.0258,Neutral
GOOGL,Google Adds AI Visibility Reports to Search Console,CMSWire,2026-06-03T17:35:25Z,0.0,Neutral,0.0,Neutral
GOOGL,"AI spending from 4 tech giants will exceed the GDP of Japan through 2030, Goldman says",Business Insider,2026-06-03T16:03:43Z,0.0,Neutral,0.0,Neutral
GOOGL,Alphabet to raise $84.75 billion in upsized equity offering to fund AI ambitions,Yahoo Entertainment,2026-06-03T15:36:03Z,0.0,Neutral,0.0,Neutral
GOOGL,Alphabet to raise $84.75 billion in upsized equity offering to fund AI ambitions,CNA,2026-06-03T15:36:03Z,0.0,Neutral,0.0,Neutral
GOOGL,"‘IPL is done, get back to business’: Why Uday Kotak thinks Google’s $80 billion raise is a wake-up call for India Inc",The Times of India,2026-06-03T14:48:33Z,0.0,Neutral,0.0,Neutral
GOOGL,Buffett’s Berkshire Hathaway Just Made its First Major AI Investment: Here’s the Next AI Buy It Could Make with its $400 Billion Pile of Cash,24/7 Wall St.,2026-06-03T14:03:15Z,0.10416666666666667,Positive,0.0,Neutral
GOOGL,Alphabet's $80 billion stock sale shows how expensive AI is getting: Chart of the Day,Yahoo Entertainment,2026-06-03T14:01:53Z,-0.5,Negative,0.0,Neutral
GOOGL,Berkshire Under Buffett’s Successor Makes $10 Billion AI Bet,24/7 Wall St.,2026-06-03T12:11:21Z,0.0,Neutral,0.2263,Positive
GOOGL,Goldman’s Solomon sees ‘more greed than fear’ in AI market,Bankingdive.com,2026-06-03T12:01:50Z,0.5,Positive,-0.4019,Negative
GOOGL,"When IPOs go wrong: SpaceX, AI firms face a delicate process",The Times of India,2026-06-03T10:31:56Z,-0.4,Negative,-0.4404,Negative
GOOGL,"When IPOs go wrong: SpaceX, AI firms face a delicate process",Yahoo Entertainment,2026-06-03T10:03:56Z,-0.4,Negative,-0.4404,Negative
GOOGL,"When IPOs go wrong: SpaceX, AI firms face a delicate process",CNA,2026-06-03T10:03:56Z,-0.4,Negative,-0.4404,Negative
GOOGL,Google keeps finding new ways to crash the stock market's AI party,Business Insider,2026-06-03T09:50:01Z,0.13636363636363635,Positive,0.0,Neutral
GOOGL,Goldman Sachs and TD Cowen Maintain Buy Ratings on Alphabet (GOOGL) After AI Announcements at Google I/O,Yahoo Entertainment,2026-06-03T08:19:59Z,0.0,Neutral,0.0,Neutral
GOOGL,"Uday Kotak's 'Wake-Up Call' To Companies, Urges India Inc To Invest In Future",Free Press Journal,2026-06-03T07:44:24Z,0.0,Neutral,0.0,Neutral
GOOGL,"Alphabet's $80 billion stock sale leaves Wall Street in 'unprecedented territory,' says Goldman's Gutman",CNBC,2026-06-03T07:42:36Z,0.6,Positive,0.0,Neutral
GOOGL,AI stock surge drives S&P 500 to record high as NZ market slips – Market close,New Zealand Herald,2026-06-03T06:16:46Z,0.16,Positive,0.0,Neutral
GOOGL,Japan’s stock market hits new record as AI boom gathers steam,Al Jazeera English,2026-06-03T05:56:30Z,0.13636363636363635,Positive,0.0,Neutral
GOOGL,Google is investing $80 billion in AI,GSMArena.com,2026-06-03T04:55:01Z,0.0,Neutral,0.0,Neutral
GOOGL,"Uday Kotak’s AI-wake up call: As IPL ends, Asia's richest banker says 'time for India to focus on business' after Google’s $80 billion raise",The Times of India,2026-06-03T04:19:49Z,0.0,Neutral,0.5267,Positive
GOOGL,"Time for India to focus on business of business, says Uday Kotak",The Times of India,2026-06-03T04:11:04Z,0.0,Neutral,0.0,Neutral
GOOGL,AI has a water problem. Google thinks it has a fix,The Verge,2026-06-03T02:31:38Z,0.0,Neutral,-0.4019,Negative
GOOGL,The 'Next $1T Company' Just Had Its Best Day Ever,Newser,2026-06-02T20:50:00Z,0.5,Positive,0.6369,Positive
GOOG,OpenAI joins rival Anthropic in race to Wall Street,The Times of India,2026-06-09T01:18:20Z,0.0,Neutral,0.0,Neutral
GOOG,OpenAI files for US IPO after Anthropic as AI giants head to public markets,The Times of India,2026-06-09T01:17:50Z,0.0,Neutral,0.0,Neutral
GOOG,"Google upgrades NotebookLM to Gemini 3.5, adds more coding features",SiliconANGLE News,2026-06-09T00:49:22Z,0.5,Positive,0.0,Neutral
GOOG,"OpenAI IPO: ChatGPT maker files for US Stock Market initial public offering after Anthropic, SpaceX",The Times of India,2026-06-09T00:10:00Z,0.0,Neutral,0.0,Neutral
GOOG,Tech giant OpenAI files for US initial public offering,Al Jazeera English,2026-06-08T22:23:40Z,0.0,Neutral,0.0,Neutral
GOOG,OpenAI Files For U.S. IPO After Anthropic As AI Giants Head To Public Markets,HuffPost,2026-06-08T22:00:58Z,0.0,Neutral,0.0,Neutral
GOOG,OpenAI files for US IPO after Anthropic as AI giants head to public markets,CNA,2026-06-08T21:17:00Z,0.0,Neutral,0.0,Neutral
GOOG,Cipher Digital raises $810 million in junk bonds to build another Amazon data centre in Texas,The Next Web,2026-06-08T20:18:03Z,0.0,Neutral,0.1779,Positive
GOOG,"US stocks: S&P 500, Nasdaq end up as tech, chipmakers rebound",The Times of India,2026-06-08T20:02:24Z,0.0,Neutral,0.0,Neutral
GOOG,SpaceX’s $75 billion IPO is well oversubscribed as order books close ahead of Wednesday pricing,The Next Web,2026-06-08T17:39:38Z,0.0,Neutral,0.2732,Positive
GOOG,The gravity of the SpaceX IPO,Freerepublic.com,2026-06-08T17:23:12Z,0.0,Neutral,0.0,Neutral
GOOG,Intel gains on report that Google will use it to make chips,Financial Post,2026-06-08T16:30:31Z,0.0,Neutral,0.34,Positive
GOOG,"Apple stock price prediction after WWDC 2026: With Apple (AAPL) trading near its all-time high of $302.25, will AI-powered Siri drive the stock above $400?",The Times of India,2026-06-08T16:19:14Z,0.08666666666666667,Positive,0.0,Neutral
GOOG,Alphabet GOOG Stock 2026 Outlook: Strong AI Momentum Makes It a Buy for Long-Term Investors,Ibtimes.com.au,2026-06-08T14:50:30Z,0.43333333333333335,Positive,0.5106,Positive
GOOG,Alphabet taps company veteran for principal accounting post,CFO Dive,2026-06-08T14:27:24Z,0.0,Neutral,0.0,Neutral
GOOG,"U.S. Stock Market prediction for Monday: Nasdaq, S&P 500, Dow Jones crash to continue in Wall Street? These factors will determine",The Times of India,2026-06-08T01:32:42Z,0.0,Neutral,-0.4019,Negative
GOOG,Alberto Romero on Apple’s AI Spending,Thealgorithmicbridge.com,2026-06-08T00:55:56Z,0.0,Neutral,0.0,Neutral
GOOG,SpaceX’s IPO will also be a massive selling event triggering big price dislocations across the stock market as investors dump shares to buy SPCX,Fortune,2026-06-07T20:39:06Z,0.0,Neutral,-0.1027,Negative
GOOG,SpaceX’s IPO will also be a massive selling event triggering big price dislocations across the stock market as investors dump shares to buy SPCX,Yahoo Entertainment,2026-06-07T20:39:06Z,0.0,Neutral,-0.1027,Negative
GOOG,Bill Maher’s New Rule: How the kids must “fix” AI,Whyevolutionistrue.com,2026-06-07T16:15:27Z,0.13636363636363635,Positive,0.0,Neutral
GOOG,"AIQ Turned $10,000 Into $13,400 in Six Months as AI Chips Soared 34% YTD",24/7 Wall St.,2026-06-07T11:00:06Z,0.0,Neutral,0.0,Neutral
GOOG,I spent years investing into Google’s ecosystem — and now I’m regretting it,Android Authority,2026-06-07T10:30:41Z,-0.1,Negative,-0.4019,Negative
GOOG,Meta weighs raising tens of billions in stock offering after Google deal,Crypto Briefing,2026-06-07T05:39:00Z,0.0,Neutral,0.0,Neutral
GOOG,Rupee hits 96 against USD: How can falling currency impact your investments and how to protect them?,Livemint,2026-06-07T02:30:19Z,0.0,Neutral,0.25,Positive
GOOG,Fed's Mary Daly has blunt message for AI stock investors,TheStreet,2026-06-06T19:13:00Z,0.0,Neutral,0.0,Neutral
GOOG,Piper Sandler Raises PT on Alphabet (GOOGL) Stock,Yahoo Entertainment,2026-06-06T17:24:37Z,0.0,Neutral,0.0,Neutral
GOOG,Jim Cramer Believes “Alphabet Could Raise Serious Money”,Yahoo Entertainment,2026-06-06T15:05:57Z,-0.3333333333333333,Negative,-0.0772,Negative
GOOG,Warren Buffett's Berkshire triples stake in newspaper giant,TheStreet,2026-06-06T14:37:00Z,0.0,Neutral,0.0,Neutral
GOOG,"Meta, Google Could Be Among Winners As FCC Proposes New Undersea Cable Rules Targeting China Risk",Yahoo Entertainment,2026-06-06T14:31:26Z,0.13636363636363635,Positive,0.25,Positive
GOOG,"Abel goes his own way with new Berkshire investments, including billions for AI",CNBC,2026-06-06T12:31:02Z,0.36818181818181817,Positive,0.0,Neutral
