ticker,headline,source,date,polarity_score,sentiment,vader_score,vader_sentiment
TSLA,"Elon Musk Net Worth: From $788,800,000,000 today to a possible $1,000,000,000,000 after SpaceX IPO— How much would each of his 14 children get?",The Times of India,2026-06-08T12:59:25Z,0.125,Positive,0.2263,Positive
TSLA,Elon Musk Announces Google AI Infrastructure Deal Days Ahead of SpaceX IPO,Breitbart News,2026-06-08T12:16:50Z,0.0,Neutral,0.0,Neutral
TSLA,Eldorado Gold Announces First Concentrate Produced at McIlvenna Bay,Financial Post,2026-06-08T11:03:38Z,0.25,Positive,0.0,Neutral
TSLA,The 3x Leverage That Built a 192% Year Just Took Back 18% in Hours,24/7 Wall St.,2026-06-08T11:00:50Z,0.0,Neutral,0.0,Neutral
TSLA,Elon Musk's market magic,Axios,2026-06-08T11:00:06Z,0.5,Positive,0.0,Neutral
TSLA,SpaceX Left California. Its IPO Payday Did Not.,Forbes,2026-06-08T10:30:00Z,0.0,Neutral,0.0,Neutral
TSLA,$WIX Securities Notice: BFA Law Notifies Wix Investors of the Pending Securities Fraud Investigation to Recover Losses – Act Now if You Lost Money,GlobeNewswire,2026-06-08T10:17:00Z,0.0,Neutral,-0.6597,Negative
TSLA,$SRAD Securities Notice: BFA Law Notifies Sportradar Investors of the Filed Securities Class Action to Recover Losses – Act before July 17 Deadline if You Lost Money,GlobeNewswire,2026-06-08T10:17:00Z,0.1,Positive,-0.1531,Negative
TSLA,$MAX Securities Notice: BFA Law Notifies MediaAlpha Shareholders the Pending Investigation into the FTC Settlement and Alleged Deceptive Advertising,GlobeNewswire,2026-06-08T10:17:00Z,-0.1,Negative,0.296,Positive
TSLA,$HUBG Securities Notice: BFA Law Notifies Hub Group Investors of the Pending Securities Fraud Investigation to Recover Losses – Act Now if You Lost Money,GlobeNewswire,2026-06-08T10:17:00Z,0.0,Neutral,-0.6597,Negative
TSLA,$SEM Securities Notice: BFA Law Notifies Select Medical Shareholders the Pending Investigation into the $16.50 per share Acquisition,GlobeNewswire,2026-06-08T10:17:00Z,0.0,Neutral,0.5267,Positive
TSLA,$PLNT Securities Notice: BFA Law Notifies Planet Fitness Investors of the Pending Securities Fraud Investigation to Recover Losses – Act Now if You Lost Money,GlobeNewswire,2026-06-08T10:17:00Z,0.0,Neutral,-0.5106,Negative
TSLA,$INTU Securities Notice: BFA Law Notifies Intuit Investors of the Pending Securities Fraud Investigation to Recover Losses – Act Now if You Lost Money,GlobeNewswire,2026-06-08T10:17:00Z,0.0,Neutral,-0.6597,Negative
TSLA,Is Elon Musk’s SpaceX Really Worth $1.75 Trillion?,The New Yorker,2026-06-08T10:00:00Z,0.3,Positive,0.2944,Positive
TSLA,SpaceX's retail-investor push is raising some red flags,Business Insider,2026-06-08T09:50:01Z,0.0,Neutral,0.0,Neutral
TSLA,‘We didn’t see this coming’: Wall Street eats its forecasts as stocks sell off globally on fear of AI bubble ahead of SpaceX IPO,Fortune,2026-06-08T09:48:21Z,0.0,Neutral,-0.4939,Negative
TSLA,This robotics CEO wants to automate the work that makes people quit,Business Insider,2026-06-08T09:31:01Z,0.2,Positive,0.0,Neutral
TSLA,US stocks slump as fears over Big Tech shake Wall Street,Crypto Briefing,2026-06-07T23:04:16Z,0.0,Neutral,-0.5423,Negative
TSLA,Tesla showcases autonomous driving with San Francisco to Palo Alto round trip,Crypto Briefing,2026-06-07T20:14:19Z,0.1,Positive,0.0,Neutral
TSLA,Elon Musk Said He Wouldn’t Take SpaceX Public — Two Things That Changed His Mind,CleanTechnica,2026-06-07T18:33:46Z,0.0,Neutral,0.0,Neutral
TSLA,"Massive Increase in Lithium Demand Coming, Says EnergyX CEO",Yahoo Entertainment,2026-06-07T17:01:10Z,0.0,Neutral,0.2023,Positive
TSLA,AI’s mega stock deals raise specter of more shares than buyers,Fortune,2026-06-07T15:47:05Z,0.5,Positive,0.3597,Positive
TSLA,"Is Rivian Automotive, Inc. (RIVN) A Good Stock To Buy Now?",Yahoo Entertainment,2026-06-07T14:58:08Z,0.7,Positive,0.4404,Positive
TSLA,Links 6/7/2026,Nakedcapitalism.com,2026-06-07T10:55:47Z,0.0,Neutral,0.0,Neutral
TSLA,SpaceX and the rest: here’s why giga-scale IPOs could be a sign of a market bust to follow,Livemint,2026-06-07T10:30:50Z,0.0,Neutral,0.0,Neutral
TSLA,'The Big Short' investor Danny Moses unpacks how he's using prediction markets to navigate the market,Business Insider,2026-06-07T09:30:01Z,0.0,Neutral,0.0,Neutral
TSLA,Elon Musk to pitch SpaceX’s Terafab chip project to ASML employees,Crypto Briefing,2026-06-07T02:06:19Z,0.0,Neutral,0.0,Neutral
TSLA,SpaceX and other mega IPOs may wait years to join the S&P 500,Fortune,2026-06-06T20:38:27Z,-0.125,Negative,0.296,Positive
TSLA,"Tesla Sales in China Are Popping, But That Means Nothing If You Can’t Stomach TSLA Stock’s Absurd P/E Ratio",Barchart.com,2026-06-06T20:00:02Z,-0.5,Negative,0.0,Neutral
TSLA,Fed's Mary Daly has blunt message for AI stock investors,TheStreet,2026-06-06T19:13:00Z,0.0,Neutral,0.0,Neutral
TSLA,"Elon Musk Says Tesla, SpaceX's Terafab Will Be Grimes County's Largest Revenue Driver As SpaceX Defends Tax Deal",Yahoo Entertainment,2026-06-06T17:31:11Z,0.0,Neutral,-0.25,Negative
TSLA,Elon Musk sets SpaceX IPO price in blunt message to Wall Street,TheStreet,2026-06-06T15:55:35Z,0.0,Neutral,0.0,Neutral
TSLA,Nvidia market cap falls below $5T amid AI sector shifts,Crypto Briefing,2026-06-06T14:50:56Z,0.0,Neutral,0.0,Neutral
TSLA,"J.P. Morgan upgrades Tesla to Neutral, raises price target to $475",Crypto Briefing,2026-06-06T13:32:54Z,0.0,Neutral,0.0,Neutral
TSLA,Tesla’s EV Rebound Leaves Rivian and Lucid Facing a Tougher Investor Test,MarketBeat,2026-06-06T12:55:00Z,0.0,Neutral,0.1779,Positive
TSLA,Elon Musk is poised to become the first trillionaire. Just how much money is $1 trillion? | CNN Business,CNN,2026-06-06T11:21:50Z,0.225,Positive,0.25,Positive
TSLA,SpaceX and other mega IPOs may wait years to join the S&P 500,The Times of India,2026-06-06T11:02:59Z,-0.125,Negative,0.296,Positive
TSLA,Elon Musk bullet-proofed his $1 trillion ‘Mars-shot’ pay at SpaceX after the epic battle over his $56 billion moonshot at Tesla,Fortune,2026-06-06T10:26:00Z,0.1,Positive,-0.4588,Negative
TSLA,Elon Musk bullet-proofed his $1 trillion ‘Mars-shot’ pay at SpaceX after the epic battle over his $56 billion moonshot at Tesla,Yahoo Entertainment,2026-06-06T10:26:00Z,0.1,Positive,-0.4588,Negative
TSLA,"JPMorgan upgrades Tesla to Neutral, raises price target to $475 after eight years of bearish calls",Crypto Briefing,2026-06-06T08:49:34Z,0.0,Neutral,0.0,Neutral
TSLA,The Elon Premium is Real,Dailyreckoning.com,2026-06-05T22:00:25Z,0.2,Positive,0.0,Neutral
TSLA,JPMorgan Turns Rosy on Tesla a Day After Dimon Lauds Musk,Yahoo Entertainment,2026-06-05T20:43:35Z,0.0,Neutral,0.0,Neutral
TSLA,A Wall Street Institution Just Did Something to Elon Musk That No One Else Will,Slate Magazine,2026-06-05T20:10:54Z,0.0,Neutral,-0.296,Negative
TSLA,"Convicted short-seller Andrew Left demands mistrial, rerun of case that gripped Wall Street",New York Post,2026-06-05T19:47:15Z,0.0,Neutral,0.0,Neutral
TSLA,Stop chasing AI - here’s where to invest right now,TheStreet,2026-06-05T19:29:57Z,0.2857142857142857,Positive,-0.296,Negative
TSLA,"The AI Chip Sector Is Soaring Without Nvidia, and the Money Flow Explains Why",BeInCrypto,2026-06-05T18:35:12Z,0.0,Neutral,0.0,Neutral
TSLA,Jamie Dimon called Elon Musk the ‘Edison of our time’ as JPMorgan hosted SpaceX’s $75 billion IPO roadshow—and even invited Musk’s mom,Fortune,2026-06-05T17:20:29Z,0.0,Neutral,0.0,Neutral
TSLA,"'Borderline dishonest': Analysts shred SpaceX's IPO filing, ringing alarm bells on its $1.77 trillion valuation",Yahoo Entertainment,2026-06-05T17:10:00Z,-0.3,Negative,-0.34,Negative
TSLA,Prediction: Tesla Stock Will Hit $500 on This Date,Yahoo Entertainment,2026-06-05T17:09:43Z,0.0,Neutral,0.0,Neutral
TSLA,From hot new Jennifer Lopez romcom Office Romance to...,Dailymail.com,2026-06-05T15:56:25Z,0.19318181818181818,Positive,0.5574,Positive
TSLA,It’s Possible That SpaceX Could Collapse Spectacularly,Futurism,2026-06-05T15:50:00Z,0.3,Positive,-0.4939,Negative
TSLA,SpaceX targets $75B IPO that could make it the most valuable public company on Earth,Crypto Briefing,2026-06-05T15:39:45Z,0.25,Positive,0.5256,Positive
TSLA,"S&P 500 to Maintain Traditional Requirements, Blocking Fast-Track Entry for SpaceX, AI IPOs",Breitbart News,2026-06-05T15:37:41Z,0.0,Neutral,-0.3818,Negative
TSLA,You Might Soon Own a Piece of SpaceX,The Atlantic,2026-06-05T15:25:00Z,0.6,Positive,0.0,Neutral
TSLA,SpaceX IPO Brings ‘Prime Time’ for Advisers Ahead of Wealth Surge,Financial Post,2026-06-05T11:52:27Z,0.0,Neutral,0.4939,Positive
TSLA,Do We Need Billionaires?,Bjhess.com,2026-06-05T11:34:43Z,0.0,Neutral,0.0,Neutral
TSLA,Why big tech IPOs — starting with SpaceX next week — could leave smaller retail investors holding the bag,New York Post,2026-06-05T11:00:00Z,0.0,Neutral,-0.0516,Negative
TSLA,$WIX Stock Notification: Lose Money on Your Wix Investment? Contact BFA Law about its Ongoing Securities Fraud Investigation,GlobeNewswire,2026-06-05T10:36:00Z,0.0,Neutral,-0.6486,Negative
TSLA,$PLNT Stock Notification: Lose Money on Your Planet Fitness Investment? Contact BFA Law about its Ongoing Securities Fraud Investigation,GlobeNewswire,2026-06-05T10:36:00Z,0.0,Neutral,-0.4939,Negative
TSLA,$SRAD Stock Notification: Lose Money on Your Sportradar Investment? Contact BFA Law about the Ongoing Securities Fraud Class Action,GlobeNewswire,2026-06-05T10:36:00Z,0.1,Positive,-0.6486,Negative
TSLA,$RMAX Stock Notification: Current Shareholder of RE/MAX? Contact BFA Law about its Ongoing Investigation into the Board Over $13.80 per share Merger,GlobeNewswire,2026-06-05T10:36:00Z,0.0,Neutral,0.296,Positive
TSLA,$SEM Stock Notification: Current Shareholder of Select Medical? Contact BFA Law about its Ongoing Investigation into the Board Over $16.50 per share Acquisition,GlobeNewswire,2026-06-05T10:36:00Z,0.0,Neutral,0.296,Positive
TSLA,$INTU Stock Notification: Lose Money on Your Intuit Investment? Contact BFA Law about its Ongoing Securities Fraud Investigation,GlobeNewswire,2026-06-05T10:36:00Z,0.0,Neutral,-0.6486,Negative
TSLA,$HUBG Stock Notification: Lose Money on Your Hub Group Investment? Contact BFA Law about its Ongoing Securities Fraud Investigation,GlobeNewswire,2026-06-05T10:36:00Z,0.0,Neutral,-0.6486,Negative
TSLA,$MAX Stock Notification: Current Shareholder of MediaAlpha? Contact BFA Law about its Ongoing Investigation into the Board Over Deceptive Advertising,GlobeNewswire,2026-06-05T10:36:00Z,0.0,Neutral,0.0,Neutral
TSLA,This Saturday: Watch over 100 EVs take over Sepang Circuit,SoyaCincau.com,2026-06-05T10:16:31Z,0.0,Neutral,0.0,Neutral
TSLA,JPMorgan CEO Jamie Dimon rolled out the red carpet for Elon Musk ahead of SpaceX's IPO,Business Insider,2026-06-05T10:02:36Z,0.0,Neutral,0.0,Neutral
TSLA,"SpaceX IPO - rockets, AI losses and Musk in control",RTE,2026-06-05T07:44:37Z,0.0,Neutral,-0.4019,Negative
TSLA,SpaceX pitches its IPO to retail investors with a 17-minute video,Crypto Briefing,2026-06-05T06:16:35Z,0.0,Neutral,0.0,Neutral
TSLA,SpaceX: Flying High on Impunity,Wordpress.com,2026-06-05T03:59:29Z,0.16,Positive,0.0,Neutral
TSLA,Where Will Tesla Stock Be in 3 Years?,Yahoo Entertainment,2026-06-05T03:42:00Z,0.0,Neutral,0.0,Neutral
TSLA,"SpaceX’s US$1.77 trillion IPO: The red flags, the green flags, the bad sci-fi novel bits - Tech Insider",New Zealand Herald,2026-06-05T03:00:13Z,-0.3,Negative,-0.296,Negative
TSLA,"SpaceX IPO: rockets, AI losses and Musk in control",The Times of India,2026-06-05T01:37:56Z,0.0,Neutral,-0.4019,Negative
TSLA,Ordinary People Can Invest In SpaceX IPO: Here’s How—And Why It’s Risky,Forbes,2026-06-04T20:22:54Z,-0.25,Negative,-0.2023,Negative
TSLA,Meta steals a tactic from Tesla and builds data centers in tents | TechCrunch,TechCrunch,2026-06-04T19:34:05Z,0.0,Neutral,-0.5106,Negative
TSLA,Doja Cat blasts Elon Musk as 'barrel-chested Ewok' who looks like a 'frog' in unhinged rant demanding changes to X,Dailymail.com,2026-06-04T19:19:07Z,0.0,Neutral,-0.2023,Negative
TSLA,SpaceX and Anthropic are about to go public—and your 401(k) may be forced to buy in,Fortune,2026-06-04T17:10:55Z,-0.30000000000000004,Negative,-0.4588,Negative
TSLA,JPMorgan’s Jamie Dimon to pitch Elon Musk’s SpaceX IPO to uber-rich clients,New York Post,2026-06-04T17:08:55Z,0.0,Neutral,0.0,Neutral
TSLA,Goldman Sachs Predicts SpaceX Revenue Will Surge 100X By 2030,24/7 Wall St.,2026-06-04T16:31:26Z,0.0,Neutral,0.0,Neutral
TSLA,One-third of Americans’ wealth is now tied to the stock market — a record high,New York Post,2026-06-04T16:24:41Z,0.16,Positive,0.4939,Positive
TSLA,,Sfstandard.com,2026-06-04T16:10:49Z,0.0,Neutral,0.0,Neutral
TSLA,SpaceX Sets $135 Price for Record $75 Billion IPO as Musk Takes Rocket Firm Public: Who Can Invest?,Ibtimes.com.au,2026-06-04T15:49:46Z,-0.1,Negative,0.0,Neutral
TSLA,SpaceX IPO Could Make Elon Musk Humanity's First Trillionaire,Breitbart News,2026-06-04T15:15:06Z,0.25,Positive,0.0,Neutral
TSLA,"Buy, Hold, or Sell: Is Tesla Stock a Sell Above $400?",Yahoo Entertainment,2026-06-04T15:10:21Z,0.0,Neutral,0.0,Neutral
TSLA,"XPENG Invited to CVPR for the Third Time, Showcasing China's Advances in Physical AI to the World",PRNewswire,2026-06-04T14:59:00Z,0.0,Neutral,0.0,Neutral
TSLA,SpaceX seeks a record $75 bn in stock market debut,The Times of India,2026-06-04T14:09:18Z,0.0,Neutral,0.0,Neutral
TSLA,Elon Musk is steamrolling Wall Street to become a trillionaire,The Verge,2026-06-04T13:56:19Z,0.0,Neutral,0.0,Neutral
TSLA,Jamie Dimon to pitch JPMorgan’s ultra-rich clients on SpaceX IPO,Financial Post,2026-06-04T13:21:45Z,0.0,Neutral,0.0,Neutral
TSLA,Buried in SpaceX’s IPO: a Tesla merger clue and a $3.75 billion insider windfall for friends and family,Fortune,2026-06-04T10:12:40Z,0.0,Neutral,0.4767,Positive
TSLA,"Bitget Rolls Out Stocks 2.0, Linking Tokenized Equities to Real U.S. Market Liquidity",GlobeNewswire,2026-06-04T10:00:00Z,0.2,Positive,0.0,Neutral
TSLA,SpaceX plans record stock market debut that could make Elon Musk a trillionaire,CBS News,2026-06-04T09:53:22Z,0.0,Neutral,0.0,Neutral
AVGO,India back at no.6 in m-cap league after Korea stock rout,The Times of India,2026-06-09T01:42:30Z,0.0,Neutral,0.0,Neutral
AVGO,"South Korean stocks drop 9%, led by losses in Samsung and SK Hynix",Crypto Briefing,2026-06-09T00:30:43Z,0.0,Neutral,-0.5859,Negative
AVGO,Stock market today: Live updates,CNBC,2026-06-08T22:05:34Z,0.13636363636363635,Positive,0.0,Neutral
AVGO,"US stocks: S&P 500, Nasdaq end up as tech, chipmakers rebound",The Times of India,2026-06-08T20:02:24Z,0.0,Neutral,0.0,Neutral
AVGO,The gravity of the SpaceX IPO,Freerepublic.com,2026-06-08T17:23:12Z,0.0,Neutral,0.0,Neutral
AVGO,Is Broadcom (AVGO) the Best Stock in Chase Coleman’s Tiger Global?,Yahoo Entertainment,2026-06-08T17:12:13Z,0.5,Positive,0.6369,Positive
AVGO,The AI trade’s worst day in a year became a buying opportunity by Monday,Fortune,2026-06-08T16:58:33Z,-1.0,Negative,-0.3182,Negative
AVGO,"If This Wall Street Call is Right, Broadcom Stock Just Became a Historic Buy Opportunity",Yahoo Entertainment,2026-06-08T16:55:57Z,0.14285714285714285,Positive,0.4215,Positive
AVGO,"Got $25,000? Broadcom or Qualcomm: The Clear Winner for Growth Investors This Year",24/7 Wall St.,2026-06-08T16:47:29Z,0.09999999999999999,Positive,0.8402,Positive
AVGO,Jim Cramer Warns: AI Stocks Face 50% Crash Without Earnings Growth,24/7 Wall St.,2026-06-08T16:47:00Z,0.0,Neutral,-0.6467,Negative
AVGO,Micron erases weeks of 2026 rally in shocking move,TheStreet,2026-06-08T16:37:17Z,-1.0,Negative,-0.4019,Negative
AVGO,Cramer drops rare message on 2 surging AI stocks and SpaceX,TheStreet,2026-06-08T16:03:00Z,0.3,Positive,0.0,Neutral
AVGO,Marvell's S&P 500 Inclusion Could Spark Fresh ETF Buying Despite Valuation Concerns,Yahoo Entertainment,2026-06-08T15:46:41Z,0.3,Positive,0.4939,Positive
AVGO,Jim Cramer Considers CrowdStrike Stock Decline a “Buying Opportunity”,Yahoo Entertainment,2026-06-08T15:34:38Z,0.0,Neutral,0.0,Neutral
AVGO,Jim Cramer on Broadcom: “The Disappointing Earnings May Not Be as Crushing as We Think”,Yahoo Entertainment,2026-06-08T15:34:30Z,-0.09999999999999998,Negative,-0.2709,Negative
AVGO,S&P 500 drops 2.64% as investors dump tech for healthcare and consumer staples,Crypto Briefing,2026-06-08T15:32:00Z,0.0,Neutral,-0.3818,Negative
AVGO,Investors Are Punishing Broadcom Stock After Earnings. They’re Missing a 200% Spike in Semiconductor Revenue Ahead.,Yahoo Entertainment,2026-06-08T14:48:22Z,-0.2,Negative,-0.7003,Negative
AVGO,Alphabet taps company veteran for principal accounting post,CFO Dive,2026-06-08T14:27:24Z,0.0,Neutral,0.0,Neutral
AVGO,Scared of a stock market bubble? These 3 charts will ease your darkest fears.,Yahoo Entertainment,2026-06-08T13:42:41Z,0.0,Neutral,-0.7506,Negative
AVGO,"⚡ Weekly Recap: Instagram Account Hacks, Android Zero-Day, GitHub Worm and More",Internet,2026-06-08T13:18:57Z,0.5,Positive,0.0,Neutral
AVGO,"TQQQ Turned $10,000 Into $353,789, but Friday’s 14% Crash Shows Leverage Cuts Both Ways",24/7 Wall St.,2026-06-08T13:14:23Z,0.0,Neutral,-0.7469,Negative
AVGO,HSBC Raises Broadcom (AVGO) Price Target on AI ASIC Growth Outlook,Yahoo Entertainment,2026-06-08T12:49:43Z,0.0,Neutral,0.3818,Positive
AVGO,"Dow Jones| Nasdaq | US Stock Market Today | Live: S&P 500, Nasdaq futures edge higher as chip stocks regain footing",Economictimes.com,2026-06-08T12:16:41Z,0.19318181818181818,Positive,0.0,Neutral
AVGO,"Why ROM Holders Watched $10,000 Evaporate to $8,655 When NVIDIA and Broadcom Stumbled on Friday",24/7 Wall St.,2026-06-08T12:14:57Z,0.0,Neutral,0.0,Neutral
AVGO,"The iShares Korea ETF (EWY) Dropped 14% in Its Most Brutal Session in Six Years, and It Started With Broadcom",24/7 Wall St.,2026-06-08T12:00:15Z,-0.1875,Negative,-0.659,Negative
AVGO,Marvell shares jump after chipmaker wins spot in S&P 500,CNA,2026-06-08T11:56:40Z,0.3,Positive,0.7096,Positive
AVGO,Marvell shares jump after chipmaker wins spot in S&P 500,Yahoo Entertainment,2026-06-08T11:56:40Z,0.3,Positive,0.7096,Positive
AVGO,The 3x Leverage That Built a 192% Year Just Took Back 18% in Hours,24/7 Wall St.,2026-06-08T11:00:50Z,0.0,Neutral,0.0,Neutral
AVGO,"SOXQ Semiconductor ETF Surges 181.74% as AI Chip Boom Lifts NVIDIA, Broadcom, AMD",24/7 Wall St.,2026-06-08T09:30:49Z,0.0,Neutral,0.0,Neutral
AVGO,Tech stocks dive as Fed bets rattle AI rally,The Times of India,2026-06-08T04:21:30Z,0.0,Neutral,0.0,Neutral
AVGO,"Why is market crashing today? Sensex plunges 800 points, Nifty below 23,100. 6 factors behind bloodbath on D-Street",The Times of India,2026-06-08T04:01:57Z,-0.4,Negative,0.4019,Positive
AVGO,"U.S. Stock Market prediction for Monday: Nasdaq, S&P 500, Dow Jones crash to continue in Wall Street? These factors will determine",The Times of India,2026-06-08T01:32:42Z,0.0,Neutral,-0.4019,Negative
AVGO,Our systems editor flew all the way to Taiwan and still couldn't get away from AI,Theregister.com,2026-06-07T23:00:00Z,0.0,Neutral,0.0,Neutral
AVGO,"Markets face triple threat of Iran war reigniting, AI bubble popping, and Fed rates rising while epic SpaceX IPO could fuel even more chaos",Fortune,2026-06-07T22:43:39Z,0.3,Positive,-0.9061,Negative
AVGO,Cathie Wood’s ARK Buys Coinbase and Circle While Trimming Archer and Baidu,Cryptoprowl.com,2026-06-07T19:46:00Z,0.0,Neutral,0.0,Neutral
AVGO,"NVDL Collapsed 12% in a Single Day as Nvidia Lost $279 Billion, Exposing How Leverage Compounds on Bad Tape",24/7 Wall St.,2026-06-07T19:15:11Z,-0.3857142857142856,Negative,-0.8402,Negative
AVGO,US-traded chipmakers lose $1.3T in market value amid slump,Crypto Briefing,2026-06-07T17:08:09Z,0.0,Neutral,-0.0772,Negative
AVGO,AI’s mega stock deals raise specter of more shares than buyers,Fortune,2026-06-07T15:47:05Z,0.5,Positive,0.3597,Positive
AVGO,KORU Is Up 236% Year to Date but Just Lost Half Its Value in a Single Trading Day,24/7 Wall St.,2026-06-07T15:30:26Z,-0.11904761904761904,Negative,0.0387,Neutral
AVGO,The business of AI is facing 4 harsh realities,Axios,2026-06-07T12:42:03Z,-0.2,Negative,-0.4404,Negative
AVGO,"Micron, Marvell shares tumble as chip sector faces worst day in six years",Crypto Briefing,2026-06-07T12:20:41Z,-1.0,Negative,-0.4404,Negative
AVGO,"AIQ Turned $10,000 Into $13,400 in Six Months as AI Chips Soared 34% YTD",24/7 Wall St.,2026-06-07T11:00:06Z,0.0,Neutral,0.0,Neutral
AVGO,"Down 20%, Should You Buy Broadcom Stock on the Dip? The Answer Might Surprise You.",Yahoo Entertainment,2026-06-07T09:59:00Z,-0.15555555555555556,Negative,0.2732,Positive
AVGO,A $360 Semiconductor ETF Position Became $638 in Just Over Five Months. Here’s the Real Story.,24/7 Wall St.,2026-06-07T09:30:46Z,0.2,Positive,0.0,Neutral
AVGO,NASDAQ sinks 4% as AI stocks tumble on rate-hike fears,Crypto Briefing,2026-06-07T08:00:04Z,-0.1,Negative,-0.4215,Negative
AVGO,"FIIs, weak global cues among 5 factors that could keep D-St under pressure this week",The Times of India,2026-06-07T04:09:40Z,-0.1875,Negative,-0.6249,Negative
AVGO,Over $1T wiped from US stock market in two hours as chip stocks crater,Crypto Briefing,2026-06-07T00:33:10Z,0.0,Neutral,0.0,Neutral
AVGO,"Nasdaq, S&P 500 suffer worst day of year, as AI stocks tumble, Fed rate-hike odds rise",RNZ,2026-06-06T23:00:00Z,-1.0,Negative,-0.8225,Negative
AVGO,AP Business SummaryBrief at 9:46 a.m. EDT,Rutlandherald.com,2026-06-06T19:06:48Z,0.0,Neutral,0.0,Neutral
AVGO,SCHD’s $85 Billion Strategy Now Concentrates 41 Percent of Your Money in Just Ten Stocks,24/7 Wall St.,2026-06-06T16:11:45Z,0.0,Neutral,0.0,Neutral
AVGO,The day all hedges fell,BusinessLine,2026-06-06T15:58:35Z,0.0,Neutral,0.0,Neutral
AVGO,CrowdStrike Earnings Beat Sparks Selloff—Buy the Dip?,MarketBeat,2026-06-06T13:45:00Z,0.0,Neutral,0.0,Neutral
AVGO,MarketBeat Week in Review – 06/01 - 06/05,MarketBeat,2026-06-06T11:00:00Z,0.0,Neutral,0.0,Neutral
AVGO,Emerging market assets fall for third straight session as South Korean equities slump,Crypto Briefing,2026-06-06T07:38:36Z,0.1,Positive,0.3818,Positive
AVGO,US stock market crash explained: Why did Nasdaq plunge 4% to log worst day in over a year,The Times of India,2026-06-06T04:20:43Z,-1.0,Negative,-0.7783,Negative
AVGO,AI chip stocks lose $1.3 trillion in value as semiconductor selloff deepens,BusinessLine,2026-06-06T03:29:15Z,0.0,Neutral,-0.0772,Negative
AVGO,Nasdaq suffers biggest drop since April 2025 as chip stocks lead selloff,BusinessLine,2026-06-06T03:28:11Z,-0.6,Negative,-0.6369,Negative
AVGO,Chip slump erases $1.3 trillion in stock market value,The Times of India,2026-06-06T03:10:11Z,0.0,Neutral,0.34,Positive
AVGO,Wall Street suffers worst hit of 2026 so far amid massive stock sell-off,ABC News (AU),2026-06-06T01:16:29Z,-0.375,Negative,-0.802,Negative
AVGO,"Markets have worst day since October as tech stocks lead the way down, traders lose hope of rate cut",Fortune,2026-06-05T23:10:12Z,-0.5777777777777777,Negative,-0.7184,Negative
AVGO,"S&P 500 sees $1.8 trillion wipeout, Nasdaq tallies biggest point drop on record: What investors need to know about Friday’s selloff",MarketWatch,2026-06-05T22:27:00Z,0.0,Neutral,-0.2732,Negative
AVGO,"Stock Market Today, June 5: Broadcom Falls as Strong AI Results Fail to Lift Guidance",Yahoo Entertainment,2026-06-05T21:59:42Z,-0.033333333333333326,Negative,-0.0516,Negative
AVGO,Decoding AVGO Stock's Premium Valuation,Trefis,2026-06-05T21:33:39Z,0.0,Neutral,0.0,Neutral
AVGO,Marvell to join S&P 500 after AI boom helps chipmaker pass profitability test,CNA,2026-06-05T21:24:22Z,0.0,Neutral,0.7096,Positive
AVGO,50% Upside For AVGO Stock?,Trefis,2026-06-05T21:00:56Z,0.0,Neutral,0.0,Neutral
AVGO,The Tech Stock Sell-Off Isn't Worrying Some Stock-Market Experts. Is a 'Bubble' About to Pop?,Investopedia,2026-06-05T20:45:48Z,0.0,Neutral,0.2584,Positive
AVGO,How major US stock indexes fared Friday 6/5/2026,seattlepi.com,2026-06-05T20:37:10Z,0.0625,Positive,0.0,Neutral
AVGO,Tech Sell-Off Takes Stocks to Worst Day Since October,Newser,2026-06-05T20:35:00Z,-1.0,Negative,-0.6249,Negative
AVGO,"Wall Street ends sharply lower as chips slide, jobs data fuels rate hike fears",The Straits Times,2026-06-05T20:33:23Z,-0.125,Negative,-0.6124,Negative
AVGO,Big fall in US tech shares as AI stock are hit,The Irish Times,2026-06-05T20:29:50Z,0.0,Neutral,0.296,Positive
AVGO,Wall Street panics as stock markets crash deep into the red despite the excellent May jobs report,Dailymail.com,2026-06-05T20:12:18Z,0.3333333333333333,Positive,-0.8224,Negative
AVGO,"US stocks today: US stocks end sharply lower as chips slide, jobs data fuels rate hike fears",The Times of India,2026-06-05T20:06:53Z,-0.125,Negative,-0.6124,Negative
AVGO,Chip selloff erases over $1 trillion in stock market value,CNA,2026-06-05T19:57:14Z,0.0,Neutral,0.34,Positive
AVGO,Stop chasing AI - here’s where to invest right now,TheStreet,2026-06-05T19:29:57Z,0.2857142857142857,Positive,-0.296,Negative
AVGO,Philadelphia Semiconductor Index falls 2% as Broadcom’s forecast weighs on chipmakers,Crypto Briefing,2026-06-05T19:09:46Z,0.0,Neutral,0.0,Neutral
AVGO,After Months of Watching AI Innovation ETFs Run These 3 Active Funds Stand Out and the Revolution Has Barely Started,24/7 Wall St.,2026-06-05T18:55:18Z,-0.041666666666666664,Negative,0.6486,Positive
AVGO,Wall Street's hottest trade is cracking in a trillion-dollar wipeout,Yahoo Entertainment,2026-06-05T18:45:40Z,0.0,Neutral,0.0,Neutral
AVGO,"The AI Chip Sector Is Soaring Without Nvidia, and the Money Flow Explains Why",BeInCrypto,2026-06-05T18:35:12Z,0.0,Neutral,0.0,Neutral
AVGO,"Why is the US stock market down today? Dow Jones, S&P 500 and Nasdaq crash big as strong jobs report, rising Treasury yields and AI stock selloff shake Wall Street — here are today's biggest gainers and losers",The Times of India,2026-06-05T17:41:38Z,0.019444444444444445,Positive,-0.4019,Negative
AVGO,"Nasdaq, S&P 500 suffer worst day of year as AI stocks tumble and Fed rate-hike odds rise | CNN Business",CNN,2026-06-05T17:08:55Z,-1.0,Negative,-0.8225,Negative
