ticker,headline,source,date,polarity_score,sentiment,vader_score,vader_sentiment
MSFT,The Trump administration might take an equity stake in OpenAI | TechCrunch,TechCrunch,2026-06-06T16:19:04Z,0.0,Neutral,0.0,Neutral
MSFT,SCHD’s $85 Billion Strategy Now Concentrates 41 Percent of Your Money in Just Ten Stocks,24/7 Wall St.,2026-06-06T16:11:45Z,0.0,Neutral,0.0,Neutral
MSFT,"Fox News AI Newsletter: Sanders bill would seize 50% of stock in OpenAI, Anthropic for sovereign wealth fund",Fox News,2026-06-06T12:00:48Z,0.0,Neutral,0.4939,Positive
MSFT,Fear Inflation? Now Is A Great Time To Buy TIPS,Forbes,2026-06-06T10:28:49Z,0.8,Positive,0.2263,Positive
MSFT,Weekend reading: Retirement Living Standards revisited,Monevator.com,2026-06-06T09:36:39Z,0.0,Neutral,0.0,Neutral
MSFT,JPMorgan sounds the alarm on the runaway cost of AI,TheStreet,2026-06-06T09:03:00Z,0.0,Neutral,-0.34,Negative
MSFT,Hon Hai Precision Industry revenue rises 34% amid Nvidia server demand,Crypto Briefing,2026-06-06T08:26:08Z,0.0,Neutral,-0.128,Negative
MSFT,Alphabet Stock vs Microsoft Stock: Which Stock To Buy in 2026?,Ibtimes.com.au,2026-06-06T08:03:06Z,0.0,Neutral,0.0,Neutral
MSFT,SpaceX needs to grow 60x in a decade to justify a $1.75 trillion valuation. No company has ever come close,Fortune,2026-06-06T07:00:00Z,0.0,Neutral,-0.296,Negative
MSFT,"Show HN: Local MCP – give Claude, Cursor and ChatGPT access to your whole Mac",Local-mcp.com,2026-06-06T01:08:40Z,0.1,Positive,0.0,Neutral
MSFT,Amundi sees further growth in Asia’s AI-led stock boom amid Fed risks,Crypto Briefing,2026-06-06T01:00:10Z,0.0,Neutral,0.128,Positive
MSFT,Microsoft Says It Will Have A Useful Quantum Computer In Three Years,Forbes,2026-06-05T22:45:48Z,0.3,Positive,0.4404,Positive
MSFT,Microsoft Shows Off In-House Tech. Is the Stock a Buy?,Yahoo Entertainment,2026-06-05T20:35:00Z,0.0,Neutral,0.0,Neutral
MSFT,"""I came to help that problem"": Xbox's Project Helix will only be expensive ""if we do not innovate,"" says CEO, hinting it may have a lower price than you think",Windows Central,2026-06-05T19:30:44Z,-0.25,Negative,0.128,Positive
MSFT,After Months of Watching AI Innovation ETFs Run These 3 Active Funds Stand Out and the Revolution Has Barely Started,24/7 Wall St.,2026-06-05T18:55:18Z,-0.041666666666666664,Negative,0.6486,Positive
MSFT,"What is actually happening to Bitcoin (BTC) right now? Why the $2 trillion crypto market crash is sending Bitcoin, Ethereum, Solana, and XRP into freefall",The Times of India,2026-06-05T18:25:04Z,0.14285714285714285,Positive,-0.4019,Negative
MSFT,NVIDIA Stock And The Hundred-Fold Compute Clue,Trefis,2026-06-05T18:16:29Z,0.0,Neutral,0.0,Neutral
MSFT,"""That's what the next 100 days will be about"": Xbox CEO Asha Sharma says memory shortages from AI are ""uncomfortable,"" and the next big ""challenge and opportunity""",Windows Central,2026-06-05T17:50:36Z,-0.125,Negative,0.3612,Positive
MSFT,Subdued Put Activity Signals Opportunity in 4 Cash-Secured Puts for Income and Value,Barchart.com,2026-06-05T17:37:17Z,0.0,Neutral,0.6369,Positive
MSFT,Apple's WWDC: Tim Cook's AI legacy at stake in his final developer conference as CEO,CNBC,2026-06-05T16:59:20Z,0.0,Neutral,0.0,Neutral
MSFT,Vanguard’s $223 Billion Growth ETF VUG Is Quietly Beating Most Large Cap Active Funds at One Tenth the Cost,24/7 Wall St.,2026-06-05T16:54:23Z,0.14523809523809525,Positive,0.3744,Positive
MSFT,SpaceX targets $75B IPO that could make it the most valuable public company on Earth,Crypto Briefing,2026-06-05T15:39:45Z,0.25,Positive,0.5256,Positive
MSFT,You Might Soon Own a Piece of SpaceX,The Atlantic,2026-06-05T15:25:00Z,0.6,Positive,0.0,Neutral
NVDA,Apple bets on overdue Siri fix to close AI gap,The Times of India,2026-06-09T02:10:03Z,0.0,Neutral,0.0,Neutral
NVDA,OpenAI joins rival Anthropic in race to Wall Street,The Times of India,2026-06-09T01:18:20Z,0.0,Neutral,0.0,Neutral
NVDA,OpenAI files for US IPO after Anthropic as AI giants head to public markets,The Times of India,2026-06-09T01:17:50Z,0.0,Neutral,0.0,Neutral
NVDA,Apple CEO Tim Cook's final keynote at WWDC; Spotlight firmly on Siri AI and Apple's partnership with Google,The Times of India,2026-06-09T01:10:53Z,-0.1,Negative,0.0,Neutral
NVDA,"Why are ASX 200 tech stocks like WiseTech, Life360 and Xero shares getting hammered on Tuesday?",Motley Fool Australia,2026-06-09T01:10:12Z,0.0,Neutral,0.5719,Positive
NVDA,Nvidia CEO says recent AI selloff offers buying opportunity,Crypto Briefing,2026-06-09T00:53:46Z,0.05,Positive,0.4215,Positive
NVDA,"South Korean stocks drop 9%, led by losses in Samsung and SK Hynix",Crypto Briefing,2026-06-09T00:30:43Z,0.0,Neutral,-0.5859,Negative
NVDA,"OpenAI IPO: ChatGPT maker files for US Stock Market initial public offering after Anthropic, SpaceX",The Times of India,2026-06-09T00:10:00Z,0.0,Neutral,0.0,Neutral
NVDA,3 ASX stocks I'd buy during a sharemarket crash,Motley Fool Australia,2026-06-08T23:53:50Z,0.0,Neutral,-0.4019,Negative
NVDA,Amazon inks multibillion-dollar optical manufacturing deal with Corning,SiliconANGLE News,2026-06-08T23:14:17Z,0.0,Neutral,0.1779,Positive
NVDA,Doosan combines products and manufacturing with Nvidia’s AI platforms,Crypto Briefing,2026-06-08T22:57:25Z,0.0,Neutral,0.0,Neutral
NVDA,Tech giant OpenAI files for US initial public offering,Al Jazeera English,2026-06-08T22:23:40Z,0.0,Neutral,0.0,Neutral
NVDA,ChatGPT maker OpenAI files for IPO looking to capitalize on investor appetite for AI boom,New York Post,2026-06-08T22:02:59Z,0.0,Neutral,0.0,Neutral
NVDA,OpenAI Files For U.S. IPO After Anthropic As AI Giants Head To Public Markets,HuffPost,2026-06-08T22:00:58Z,0.0,Neutral,0.0,Neutral
NVDA,OpenAI files for US IPO after Anthropic as AI giants head to public markets,CNA,2026-06-08T21:17:00Z,0.0,Neutral,0.0,Neutral
NVDA,PhysicsX reels in $300M to speed up hardware design with AI,SiliconANGLE News,2026-06-08T20:50:57Z,0.0,Neutral,0.0,Neutral
NVDA,Cipher Digital raises $810 million in junk bonds to build another Amazon data centre in Texas,The Next Web,2026-06-08T20:18:03Z,0.0,Neutral,0.1779,Positive
NVDA,SpaceX’s $75 billion IPO is well oversubscribed as order books close ahead of Wednesday pricing,The Next Web,2026-06-08T17:39:38Z,0.0,Neutral,0.2732,Positive
NVDA,The gravity of the SpaceX IPO,Freerepublic.com,2026-06-08T17:23:12Z,0.0,Neutral,0.0,Neutral
NVDA,This Cybersecurity ETF Just Surged 39% in a Single Month. The YTD Is Even Better.,24/7 Wall St.,2026-06-08T17:00:14Z,0.2142857142857143,Positive,0.4404,Positive
NVDA,The AI trade’s worst day in a year became a buying opportunity by Monday,Fortune,2026-06-08T16:58:33Z,-1.0,Negative,-0.3182,Negative
NVDA,"Got $25,000? Broadcom or Qualcomm: The Clear Winner for Growth Investors This Year",24/7 Wall St.,2026-06-08T16:47:29Z,0.09999999999999999,Positive,0.8402,Positive
NVDA,Jim Cramer Warns: AI Stocks Face 50% Crash Without Earnings Growth,24/7 Wall St.,2026-06-08T16:47:00Z,0.0,Neutral,-0.6467,Negative
NVDA,Transcript: Chris Davis of Davis Funds,Ritholtz.com,2026-06-08T16:30:45Z,0.0,Neutral,0.0,Neutral
NVDA,Intel gains on report that Google will use it to make chips,Financial Post,2026-06-08T16:30:31Z,0.0,Neutral,0.34,Positive
NVDA,This Stock Is My Biggest Bet For June,24/7 Wall St.,2026-06-08T16:25:23Z,0.0,Neutral,0.0,Neutral
NVDA,UFO ETF Faces a Concentration Crisis as Virgin Galactic Surge Becomes Unsustainable,24/7 Wall St.,2026-06-08T16:00:56Z,0.0,Neutral,-0.6249,Negative
NVDA,"The Warsh-Trump Honeymoon Is Officially Over. No Matter What Happens Next, the Stock Market Will Probably Lose",24/7 Wall St.,2026-06-08T15:48:04Z,0.0,Neutral,-0.5859,Negative
NVDA,Marvell's S&P 500 Inclusion Could Spark Fresh ETF Buying Despite Valuation Concerns,Yahoo Entertainment,2026-06-08T15:46:41Z,0.3,Positive,0.4939,Positive
NVDA,AI Is Slowing Down,Wheresyoured.at,2026-06-08T15:46:37Z,-0.15555555555555556,Negative,0.0,Neutral
NVDA,Nebius Is Up Nearly 175% This Year—Here's What's Driving the Latest Run,MarketBeat,2026-06-08T15:45:00Z,0.3,Positive,0.0,Neutral
NVDA,Is AI riding a bubble?,BusinessLine,2026-06-08T15:42:30Z,0.0,Neutral,0.0,Neutral
NVDA,Jim Cramer Says NVIDIA Stock Has Been “Playing a Game of Shoots and Ladders”,Yahoo Entertainment,2026-06-08T15:34:33Z,-0.4,Negative,0.0,Neutral
NVDA,"Is Micron Technology, Inc. (MU) A Good Stock To Buy Now?",Yahoo Entertainment,2026-06-08T15:24:05Z,0.7,Positive,0.4404,Positive
NVDA,Is NVIDIA Corporation (NVDA) A Good Stock To Buy Now?,Yahoo Entertainment,2026-06-08T15:21:42Z,0.7,Positive,0.4404,Positive
NVDA,Escorts are charging as much as $6k per hour thanks to Silicon Valley’s AI boom,New York Post,2026-06-08T15:19:16Z,0.2,Positive,0.4404,Positive
NVDA,"Why is the US stock market rallying big today? Dow Jones, S&P 500 and Nasdaq surge on AI boom — Nvidia and Intel jump as Nasdaq significantly outperformed both the Dow and S&P",The Times of India,2026-06-08T15:07:20Z,0.1875,Positive,0.0,Neutral
NVDA,Dell's new Nvidia RTX Spark mini PC has distinct Mac Studio vibes — and I think it could tempt buyers away from Apple given its current stock woes,TechRadar,2026-06-08T15:05:10Z,0.14545454545454545,Positive,-0.25,Negative
NVDA,"On theCUBE Pod: Snowflake, Cisco and the race to control the AI stack",SiliconANGLE News,2026-06-08T14:59:16Z,0.0,Neutral,0.0,Neutral
NVDA,"Intel Surges 12% as Hitachi Pact, Google-NVIDIA Foundry Buzz Fuel an AI Comeback",24/7 Wall St.,2026-06-08T14:59:03Z,0.0,Neutral,0.0,Neutral
NVDA,Forget Marvell: 1 Unstoppable Semiconductor Stock to Buy Hand Over Fist After the Market Pullback,24/7 Wall St.,2026-06-08T14:56:21Z,0.0,Neutral,0.128,Positive
NVDA,Nvidia Shares Advance 1.6% as AI Demand Fuels Continued Semiconductor Strength,Ibtimes.com.au,2026-06-08T14:52:26Z,0.0,Neutral,0.5994,Positive
NVDA,Intel Foundry comeback! Is a bigger Intel stock surge ahead? INTC shares surge 9.16% today as Google’s 3 million TPU order and Nvidia testing fuel Intel’s AI revival,The Times of India,2026-06-08T14:38:43Z,0.0,Neutral,0.3595,Positive
NVDA,Nvidia Stock Will Trade at This Price in 2027,24/7 Wall St.,2026-06-08T14:27:47Z,0.0,Neutral,0.0,Neutral
NVDA,"Buy, Sell, or Hold: CoreWeave at $100",24/7 Wall St.,2026-06-08T14:15:11Z,0.0,Neutral,0.0,Neutral
NVDA,"Stocks making the biggest moves premarket: Nvidia, Marvell, Flex and more - CNBC",Slashdot.org,2026-06-08T14:13:09Z,0.5,Positive,0.0,Neutral
NVDA,US Stocks Rebound From Selloff as Nvidia Leads Big-Tech Gains,Financial Post,2026-06-08T14:07:28Z,0.0,Neutral,0.34,Positive
NVDA,US market today: Alphabet taps Intel to make three million in-house chips: Report,The Times of India,2026-06-08T14:02:03Z,0.0,Neutral,0.0,Neutral
NVDA,"Iran announces 'end of military operations' against Israel, but warns Lebanon strikes could trigger escalation - CNBC",Slashdot.org,2026-06-08T13:33:23Z,-0.1,Negative,-0.5927,Negative
NVDA,Amazon’s billion-dollar Corning deal shows fibre is the new bottleneck in the AI build-out,The Next Web,2026-06-08T13:18:15Z,0.13636363636363635,Positive,0.0,Neutral
NVDA,"TQQQ Turned $10,000 Into $353,789, but Friday’s 14% Crash Shows Leverage Cuts Both Ways",24/7 Wall St.,2026-06-08T13:14:23Z,0.0,Neutral,-0.7469,Negative
NVDA,Is Micron Quietly Preparing for the Collapse in AI Demand?,24/7 Wall St.,2026-06-08T13:02:25Z,0.0,Neutral,-0.5719,Negative
NVDA,Cerebras shares climb as Wall Street brokerages back AI chip strategy,The Times of India,2026-06-08T12:53:26Z,0.0,Neutral,0.296,Positive
NVDA,Cerebras shares climb as Wall Street brokerages back AI chip strategy,CNA,2026-06-08T12:52:42Z,0.0,Neutral,0.296,Positive
NVDA,SpaceX Has a Plan for AI That Sounds Like Pure Science Fiction. How It Impacts Your Wealth,24/7 Wall St.,2026-06-08T12:44:37Z,0.21428571428571427,Positive,0.6908,Positive
NVDA,Amazon strikes multibillion-dollar deal with Corning to power AI data centers in U.S.,CNBC,2026-06-08T12:35:01Z,0.0,Neutral,-0.2023,Negative
NVDA,Elon Musk Announces Google AI Infrastructure Deal Days Ahead of SpaceX IPO,Breitbart News,2026-06-08T12:16:50Z,0.0,Neutral,0.0,Neutral
NVDA,"Dow Jones| Nasdaq | US Stock Market Today | Live: S&P 500, Nasdaq futures edge higher as chip stocks regain footing",Economictimes.com,2026-06-08T12:16:41Z,0.19318181818181818,Positive,0.0,Neutral
NVDA,"Why ROM Holders Watched $10,000 Evaporate to $8,655 When NVIDIA and Broadcom Stumbled on Friday",24/7 Wall St.,2026-06-08T12:14:57Z,0.0,Neutral,0.0,Neutral
NVDA,Marvell stock surges on S&P 500 inclusion,Yahoo Entertainment,2026-06-08T12:12:42Z,0.0,Neutral,0.0,Neutral
NVDA,NVIDIA Corporation (NVDA) is a Cheap Robotics Stock to buy as the Vera CPU Tops on Autonomous Functions,Yahoo Entertainment,2026-06-08T12:01:20Z,0.4,Positive,0.5106,Positive
NVDA,"The iShares Korea ETF (EWY) Dropped 14% in Its Most Brutal Session in Six Years, and It Started With Broadcom",24/7 Wall St.,2026-06-08T12:00:15Z,-0.1875,Negative,-0.659,Negative
NVDA,Marvell shares jump after chipmaker wins spot in S&P 500,CNA,2026-06-08T11:56:40Z,0.3,Positive,0.7096,Positive
NVDA,Marvell shares jump after chipmaker wins spot in S&P 500,Yahoo Entertainment,2026-06-08T11:56:40Z,0.3,Positive,0.7096,Positive
NVDA,Inside the Mouth-Watering Numbers Justifying SpaceX’s $1.75 Trillion IPO,24/7 Wall St.,2026-06-08T11:52:55Z,0.7,Positive,0.0,Neutral
NVDA,Nvidia CEO says selloff in tech stocks is a buying opportunity,Financial Post,2026-06-08T11:45:25Z,0.0,Neutral,0.4215,Positive
NVDA,Palantir CEO Alex Karp Says He's Been Warning AI Leaders For Months About Nationalization Risks: 'The Momentum Is On The Side Of People Who...',Yahoo Entertainment,2026-06-08T11:31:08Z,0.0,Neutral,-0.5423,Negative
NVDA,Nvidia signs multi-year memory chip deal with SK Hynix,Quartz India,2026-06-08T11:17:50Z,0.0,Neutral,0.0,Neutral
NVDA,"Vulnerability Summary for the Week of June 1, 2026",Cisa.gov,2026-06-08T11:15:41Z,0.0,Neutral,-0.2263,Negative
NVDA,The 3x Leverage That Built a 192% Year Just Took Back 18% in Hours,24/7 Wall St.,2026-06-08T11:00:50Z,0.0,Neutral,0.0,Neutral
NVDA,ASML Holding N.V. (ASML) Is A Top AI Stock In Billionaire Ken Fisher’s Portfolio,Yahoo Entertainment,2026-06-08T10:56:25Z,0.5,Positive,0.2023,Positive
NVDA,NVIDIA (NVDA) Is A Top AI Stock In Billionaire Ken Fisher’s Portfolio,Yahoo Entertainment,2026-06-08T10:53:44Z,0.5,Positive,0.2023,Positive
NVDA,The Stock Market's Biggest Winners And Losers Of 2026 So Far,Forbes,2026-06-08T10:30:00Z,-0.05,Negative,-0.0772,Negative
NVDA,"Sensex today | Stock Market Highlights: Sensex settles at 73,524.26, down 719.08 pts (0.97%); Nifty ends at 23,123, down 243.70 pts (1.04%)",BusinessLine,2026-06-08T10:28:12Z,-0.15555555555555556,Negative,0.4019,Positive
NVDA,Nvidia deepens South Korea ties through new AI partnerships (NVDA),Advfn.com,2026-06-08T10:18:31Z,0.13636363636363635,Positive,0.0,Neutral
NVDA,AI Trade Unwind Rocks Korean Traders Leveraged for One-Way Bet,Yahoo Entertainment,2026-06-08T09:40:51Z,0.0,Neutral,0.0,Neutral
NVDA,Wall Street says Apple can't afford a miss on AI at this year's WWDC,Business Insider,2026-06-08T09:40:02Z,0.0,Neutral,0.1139,Positive
NVDA,"SOXQ Semiconductor ETF Surges 181.74% as AI Chip Boom Lifts NVIDIA, Broadcom, AMD",24/7 Wall St.,2026-06-08T09:30:49Z,0.0,Neutral,0.0,Neutral
NVDA,"11:11 | Tensions in West Asia flare up, crude oil, Zverev wins Roland Garros, Philippines earthquake and more",CNBCTV18,2026-06-08T09:19:20Z,0.03333333333333335,Positive,-0.4019,Negative
NVDA,Nvidia clinches deals with South Korean giants,RTE,2026-06-08T09:01:07Z,0.0,Neutral,0.0,Neutral
NVDA,"Stock market today: Dow, S&P 500, Nasdaq jump as chip stocks rebound, Iran and Israel exchange strikes",Yahoo Entertainment,2026-06-08T08:53:10Z,0.0,Neutral,-0.3612,Negative
NVDA,Boost Run (BRUN) Debuts on Nasdaq With $940M in Backed Contracted Revenue,Yahoo Entertainment,2026-06-08T08:26:27Z,0.0,Neutral,0.4215,Positive
NVDA,From AI Optimism to Monetary Tightening Concerns: What China’s Market Drop Signals | Business,Devdiscourse,2026-06-08T06:54:29Z,0.0,Neutral,0.34,Positive
NVDA,Dan Loeb says $5 trillion Nvidia is still undervalued,Business Insider,2026-06-08T06:36:35Z,0.0,Neutral,0.0,Neutral
NVDA,South Korea's KOSPI craters nearly 9% as Fed fears hammer tech stocks,CNA,2026-06-08T06:32:03Z,0.1,Positive,-0.4215,Negative
NVDA,South Korea's KOSPI craters nearly 9% as Fed fears hammer tech stocks,CNA,2026-06-08T06:32:03Z,0.1,Positive,-0.4215,Negative
NVDA,Tech stocks plunge in Asia after record rally and renewed Middle East attacks,BBC News,2026-06-08T06:26:52Z,0.0,Neutral,-0.4404,Negative
NVDA,Why I Can’t Wait for the AI Bubble to Crash,Naturalnews.com,2026-06-08T06:00:00Z,0.0,Neutral,-0.4019,Negative
NVDA,"Wipro, TCS drag Nifty IT 2% lower after Nasdaq crash, AI selloff",BusinessLine,2026-06-08T05:32:12Z,-0.1,Negative,-0.4767,Negative
NVDA,Circuit breakers triggered as South Korean market craters nearly 9%,The Irish Times,2026-06-08T05:28:57Z,0.1,Positive,0.0,Neutral
NVDA,NVIDIA and SK hynix Announce Multiyear Technology Partnership to Advance Memory for AI Factories - NVIDIA Newsroom,Slashdot.org,2026-06-08T05:12:17Z,0.0,Neutral,0.0,Neutral
NVDA,South Korea's KOSPI dives nearly 9% as Fed fears hammer tech stocks,The Times of India,2026-06-08T04:17:38Z,0.1,Positive,-0.4215,Negative
NVDA,Nvidia falls below $5T market cap after single-day wipeout erases $320B,Crypto Briefing,2026-06-08T02:40:24Z,0.0,Neutral,0.0,Neutral
NVDA,"China, HK stocks open lower as global tech selloff spreads to Asia",The Times of India,2026-06-08T02:13:27Z,0.0,Neutral,-0.296,Negative
NVDA,"U.S. Stock Market prediction for Monday: Nasdaq, S&P 500, Dow Jones crash to continue in Wall Street? These factors will determine",The Times of India,2026-06-08T01:32:42Z,0.0,Neutral,-0.4019,Negative
NVDA,"Nvidia partners with South Korea’s SK Hynix, Naver and Doosan to expand the country’s AI infrastructure",SiliconANGLE News,2026-06-08T01:30:16Z,0.0,Neutral,0.3182,Positive
NVDA,US stocks slump as fears over Big Tech shake Wall Street,Crypto Briefing,2026-06-07T23:04:16Z,0.0,Neutral,-0.5423,Negative
NVDA,Our systems editor flew all the way to Taiwan and still couldn't get away from AI,Theregister.com,2026-06-07T23:00:00Z,0.0,Neutral,0.0,Neutral
NVDA,NVIDIA and SK hynix Announce Multiyear Technology Partnership to Advance Memory for AI Factories,GlobeNewswire,2026-06-07T23:00:00Z,0.0,Neutral,0.0,Neutral
AMZN,Tim Cook bows out with a very Tim Cook keynote,Mashable,2026-06-09T02:28:40Z,0.2,Positive,0.0,Neutral
AMZN,"Bestselling global brand behind cult buy with over 47,000 five-star ratings launches on Amazon Australia",Dailymail.com,2026-06-09T01:38:37Z,-0.2,Negative,0.1779,Positive
AMZN,"ED summons Zepto founders ahead of IPO over foreign investments, financial disclosures",Moneycontrol,2026-06-09T01:32:18Z,-0.0625,Negative,0.0,Neutral
AMZN,OpenAI joins rival Anthropic in race to Wall Street,The Times of India,2026-06-09T01:18:20Z,0.0,Neutral,0.0,Neutral
AMZN,OpenAI files for US IPO after Anthropic as AI giants head to public markets,The Times of India,2026-06-09T01:17:50Z,0.0,Neutral,0.0,Neutral
AMZN,Motopower OBD2 Diagnostic Scan Tool for $20 + free shipping w/ Prime,Dealnews.com,2026-06-09T00:46:31Z,0.4,Positive,0.5106,Positive
AMZN,27-Piece Car Detailing Kit for $23 + free shipping w/ Prime,Dealnews.com,2026-06-09T00:28:46Z,0.4,Positive,0.5106,Positive
AMZN,Under Armour Men's Project Rock One E.l.f. Hoodie for from $11 + free shipping w/ Prime,Dealnews.com,2026-06-09T00:27:12Z,0.4,Positive,0.5106,Positive
AMZN,"OpenAI IPO: ChatGPT maker files for US Stock Market initial public offering after Anthropic, SpaceX",The Times of India,2026-06-09T00:10:00Z,0.0,Neutral,0.0,Neutral
AMZN,S'well 64-oz. Stainless Steel Salad Bowl Kit for $22 + free shipping w/ Prime,Dealnews.com,2026-06-09T00:01:51Z,0.30000000000000004,Positive,0.5106,Positive
AMZN,S'well 64-oz. Stainless Steel Salad Bowl Kit for $22 + free shipping w/ Prime,Dealnews.com,2026-06-09T00:01:51Z,0.30000000000000004,Positive,0.5106,Positive
AMZN,Tire Inflator Portable Air Compressor for $30 + free shipping,Dealnews.com,2026-06-08T23:56:00Z,0.4,Positive,0.5106,Positive
AMZN,3 ASX stocks I'd buy during a sharemarket crash,Motley Fool Australia,2026-06-08T23:53:50Z,0.0,Neutral,-0.4019,Negative
AMZN,Toto Drake Elongated Two-Piece Tornado Flush Toilet for $290 + free shipping,Dealnews.com,2026-06-08T23:41:10Z,0.18333333333333335,Positive,0.5106,Positive
AMZN,Amazon inks multibillion-dollar optical manufacturing deal with Corning,SiliconANGLE News,2026-06-08T23:14:17Z,0.0,Neutral,0.1779,Positive
AMZN,"Apple Watch Series 11 hits Apple’s refurbished store, but is it the best deal?",Cult of Mac,2026-06-08T22:32:16Z,1.0,Positive,0.7783,Positive
AMZN,Tech giant OpenAI files for US initial public offering,Al Jazeera English,2026-06-08T22:23:40Z,0.0,Neutral,0.0,Neutral
AMZN,"Save your skin, protect your wallet: 7 SPF early Prime Day deals",New York Post,2026-06-08T22:11:07Z,0.1,Positive,0.7003,Positive
AMZN,ChatGPT maker OpenAI files for IPO looking to capitalize on investor appetite for AI boom,New York Post,2026-06-08T22:02:59Z,0.0,Neutral,0.0,Neutral
AMZN,OpenAI Files For U.S. IPO After Anthropic As AI Giants Head To Public Markets,HuffPost,2026-06-08T22:00:58Z,0.0,Neutral,0.0,Neutral
AMZN,10000mAh Emergency Crank Radio for $24 + free shipping w/ Prime,Dealnews.com,2026-06-08T21:51:52Z,0.4,Positive,0.1779,Positive
AMZN,OpenAI Confidentially Files for IPO on the Heels of SpaceX and Anthropic,Wired,2026-06-08T21:31:58Z,0.0,Neutral,0.0,Neutral
AMZN,OpenAI files for US IPO after Anthropic as AI giants head to public markets,CNA,2026-06-08T21:17:00Z,0.0,Neutral,0.0,Neutral
AMZN,"I quit Safari for Chrome, but these new MacOS 27 features could pull me back",ZDNet,2026-06-08T21:12:50Z,0.06818181818181818,Positive,0.0,Neutral
AMZN,Brother HL-L5210DW Monochrome Laser Printer for $220 + free shipping w/ Prime,Dealnews.com,2026-06-08T21:10:33Z,0.4,Positive,0.5106,Positive
AMZN,AI Stock Boom May Have Just Resumed,Newser,2026-06-08T20:46:00Z,0.0,Neutral,0.0,Neutral
AMZN,Ring Battery Doorbell (2024) 2-Pack for $90 + free shipping,Dealnews.com,2026-06-08T20:19:23Z,0.4,Positive,0.5106,Positive
AMZN,Cipher Digital raises $810 million in junk bonds to build another Amazon data centre in Texas,The Next Web,2026-06-08T20:18:03Z,0.0,Neutral,0.1779,Positive
AMZN,Everything you need to know about Prime Day 2026,The Verge,2026-06-08T20:06:26Z,0.0,Neutral,0.0,Neutral
AMZN,"Best early Prime Day camping deals: Up to 40% off tents, grills, outdoor fans and more",Fox News,2026-06-08T19:58:27Z,0.5333333333333333,Positive,0.6369,Positive
AMZN,"Best Amazon deals under $50 before Prime Day: Skechers, Sony, Blink and more",Fox News,2026-06-08T19:09:17Z,0.75,Positive,0.7096,Positive
AMZN,Stock Up On Tide Pods! 168 Tide Pods For $21.98-$27.17 After Rebate!,Dansdeals.com,2026-06-08T19:06:05Z,0.0,Neutral,0.0,Neutral
AMZN,"6"" Herding Soccer Ball for Dogs for $12 + free shipping w/ Prime",Dealnews.com,2026-06-08T18:45:00Z,0.4,Positive,0.5106,Positive
AMZN,Stock up now: Emergency essentials are up to 45% off ahead of Prime Day,Fox News,2026-06-08T18:11:57Z,0.0,Neutral,-0.3818,Negative
AMZN,"The Bigger Meaning Of $10,000 Invested In Amazon Twenty Years Ago",Forbes,2026-06-08T18:00:59Z,0.0,Neutral,0.1779,Positive
AMZN,Okk Kids' DIY Robot Building Kit for $30 + free shipping,Dealnews.com,2026-06-08T17:48:54Z,0.4,Positive,0.5106,Positive
AMZN,"12"" Remote Control Boat for $45 + free shipping",Dealnews.com,2026-06-08T17:46:59Z,0.15000000000000002,Positive,0.5106,Positive
AMZN,The Best Deals Our CNET Shopping Experts Found This Week,CNET,2026-06-08T17:43:00Z,1.0,Positive,0.6369,Positive
AMZN,SpaceX’s $75 billion IPO is well oversubscribed as order books close ahead of Wednesday pricing,The Next Web,2026-06-08T17:39:38Z,0.0,Neutral,0.2732,Positive
AMZN,Useless Box for $14 + free shipping w/ Prime,Dealnews.com,2026-06-08T17:37:45Z,-0.04999999999999999,Negative,0.128,Positive
AMZN,"Augason Farms Freeze Dried Sliced Strawberries Can, 18 Servings Can – Just $17.10!",Commonsensewithmoney.com,2026-06-08T17:30:28Z,-0.25,Negative,0.126,Positive
AMZN,What’s that noise? This 50% off security camera lets you check from your phone,New York Post,2026-06-08T17:30:00Z,0.0,Neutral,0.34,Positive
AMZN,Skip the subscription: Sleepers claim cheaper alarm has ‘more features’,New York Post,2026-06-08T17:30:00Z,0.5,Positive,-0.34,Negative
AMZN,The gravity of the SpaceX IPO,Freerepublic.com,2026-06-08T17:23:12Z,0.0,Neutral,0.0,Neutral
AMZN,This ‘little speaker with power’ will make your next beach party feel like a music festival,New York Post,2026-06-08T17:06:37Z,-0.09375,Negative,0.8126,Positive
AMZN,Kelgyua Wireless Handheld Microphone System for $75 + free shipping,Dealnews.com,2026-06-08T16:54:31Z,0.4,Positive,0.5106,Positive
AMZN,‘Untouched’ powder is dubbed a gut health miracle — and it’s on sale before Prime Day,New York Post,2026-06-08T16:37:00Z,0.0,Neutral,0.5859,Positive
AMZN,Transcript: Chris Davis of Davis Funds,Ritholtz.com,2026-06-08T16:30:45Z,0.0,Neutral,0.0,Neutral
AMZN,"Early Prime Day fishing and hunting deals worth grabbing now, starting at $18",Fox News,2026-06-08T16:17:19Z,0.13333333333333333,Positive,0.2263,Positive
AMZN,Magnetic Reversible Ratcheting Screwdriver for $4 + free shipping w/ $25,Dealnews.com,2026-06-08T15:55:57Z,0.4,Positive,0.5574,Positive
AMZN,5-Foot Toilet Waterproof Strip for $2 + free shipping w/ $25,Dealnews.com,2026-06-08T15:51:32Z,0.18333333333333335,Positive,0.5106,Positive
AMZN,5-Foot Toilet Waterproof Strip for $2 + free shipping w/ $25,Dealnews.com,2026-06-08T15:51:32Z,0.18333333333333335,Positive,0.5106,Positive
AMZN,AI Is Slowing Down,Wheresyoured.at,2026-06-08T15:46:37Z,-0.15555555555555556,Negative,0.0,Neutral
AMZN,Wearable Quick-Dry Bath Towel for $3 + free shipping w/ $25,Dealnews.com,2026-06-08T15:44:17Z,0.4,Positive,0.5106,Positive
AMZN,Adjustable Jar & Bottle Opener for $2 + free shipping w/ $25,Dealnews.com,2026-06-08T15:39:37Z,0.4,Positive,0.5106,Positive
