ticker,headline,source,date,polarity_score,sentiment,vader_score,vader_sentiment
AAPL,Tim Cook bows out with a very Tim Cook keynote,Mashable,2026-06-09T02:28:40Z,0.2,Positive,0.0,Neutral
AAPL,Apple bets on overdue Siri fix to close AI gap,The Times of India,2026-06-09T02:10:03Z,0.0,Neutral,0.0,Neutral
AAPL,Apple CEO Tim Cook's final keynote at WWDC; Spotlight firmly on Siri AI and Apple's partnership with Google,The Times of India,2026-06-09T01:10:53Z,-0.1,Negative,0.0,Neutral
AAPL,3 ASX stocks I'd buy during a sharemarket crash,Motley Fool Australia,2026-06-08T23:53:50Z,0.0,Neutral,-0.4019,Negative
AAPL,Apple Siri AI Extends Personal Context Across Devices and Apps,pymnts.com,2026-06-08T23:26:52Z,0.0,Neutral,0.128,Positive
AAPL,Four star LB could be key in Matt Campbell's 2027 class,USA Today,2026-06-08T23:06:59Z,0.0,Neutral,0.0,Neutral
AAPL,"Apple share drop as new Siri, AI platform leaves investors unimpressed",The Straits Times,2026-06-08T22:56:26Z,0.13636363636363635,Positive,-0.3182,Negative
AAPL,"Apple Watch Series 11 hits Apple’s refurbished store, but is it the best deal?",Cult of Mac,2026-06-08T22:32:16Z,1.0,Positive,0.7783,Positive
AAPL,Apple refines Liquid Glass design and expands child safety tools at WWDC,SiliconANGLE News,2026-06-08T22:20:36Z,0.0,Neutral,0.4939,Positive
AAPL,Jim Cramer warns key pillars of the bull market are beginning to crumble,CNBC,2026-06-08T22:18:39Z,0.0,Neutral,-0.1027,Negative
AAPL,"I quit Safari for Chrome, but these new MacOS 27 features could pull me back",ZDNet,2026-06-08T21:12:50Z,0.06818181818181818,Positive,0.0,Neutral
AAPL,Apple debuts Siri AI as a more personal assistant built on Gemini,SiliconANGLE News,2026-06-08T21:00:15Z,0.25,Positive,0.0,Neutral
AAPL,"Hey, Siri: Apple just announced a long-awaited AI update",NPR,2026-06-08T20:41:10Z,0.0,Neutral,0.0,Neutral
AAPL,"Apple WWDC: New Siri, AI platform unveiled",The Sydney Morning Herald,2026-06-08T20:07:31Z,0.13636363636363635,Positive,0.0,Neutral
AAPL,Everything you need to know about Prime Day 2026,The Verge,2026-06-08T20:06:26Z,0.0,Neutral,0.0,Neutral
AAPL,"US stocks: S&P 500, Nasdaq end up as tech, chipmakers rebound",The Times of India,2026-06-08T20:02:24Z,0.0,Neutral,0.0,Neutral
AAPL,"Safari Gets AI Tab Organization, Notify Me, and Custom Extensions in iOS 27",Yugatech.com,2026-06-08T19:54:29Z,0.0,Neutral,0.0,Neutral
AAPL,Apple debuts Siri AI at WWDC as Tim Cook prepares to hand over the reins,Fortune,2026-06-08T19:35:54Z,0.0,Neutral,0.4939,Positive
AAPL,"Apple Investors Give Lukewarm Reaction to New Siri, AI Platform",Livemint,2026-06-08T18:55:22Z,0.13636363636363635,Positive,0.0,Neutral
AAPL,Apple reveals long-delayed Siri AI makeover at Worldwide Developers Conference,New York Post,2026-06-08T18:51:59Z,0.0,Neutral,0.0,Neutral
AAPL,Apple Unveils macOS 27 Golden Gate With New AI Siri,iPhone in Canada,2026-06-08T18:51:45Z,0.21818181818181817,Positive,0.0,Neutral
AAPL,Apple WWDC 2026: The 7 biggest announcements,The Verge,2026-06-08T18:51:19Z,0.0,Neutral,0.0,Neutral
AAPL,Apple demonstrates cross-platform Siri upgrades in macOS 27 Golden Gate at WWDC — update brings Liquid Glass improvements and unifies AI strategy,Tom's Hardware UK,2026-06-08T18:40:17Z,0.3,Positive,0.3182,Positive
AAPL,"Apple tries again on AI, turns to Google for help",The Punch,2026-06-08T18:09:21Z,-0.1,Negative,0.4019,Positive
AAPL,"Apple takes another shot at AI, turns to Google for help",Digital Journal,2026-06-08T18:05:09Z,0.0,Neutral,0.4019,Positive
AAPL,Safari Will Be Able to Monitor a Webpage and Notify You of Updates,MacRumors,2026-06-08T18:04:15Z,0.5,Positive,0.0,Neutral
AAPL,SpaceX’s $75 billion IPO is well oversubscribed as order books close ahead of Wednesday pricing,The Next Web,2026-06-08T17:39:38Z,0.0,Neutral,0.2732,Positive
AAPL,(VIDEO) Tim Cook's Final WWDC Keynote: Apple Focuses on AI Upgrades and Software Innovations in 2026,Ibtimes.com.au,2026-06-08T17:38:17Z,0.0,Neutral,0.0,Neutral
AAPL,The gravity of the SpaceX IPO,Freerepublic.com,2026-06-08T17:23:12Z,0.0,Neutral,0.0,Neutral
AAPL,Why Anxious Minds Make the Best Leaders,Psychology Today,2026-06-08T17:15:50Z,0.375,Positive,0.4939,Positive
AAPL,"Apple MacBook Air 13.6"" Laptop (2025) w/ M4 Chip, 32GB RAM, 1TB SSD $1399 & More + Free S&H",Slickdeals.net,2026-06-08T17:15:37Z,0.45,Positive,0.5563,Positive
AAPL,The Knicks’ stock hits record high on historic NBA Finals lead,New York Post,2026-06-08T16:53:40Z,0.08,Positive,0.0,Neutral
AAPL,f8 Develop is an HDR Film Negative Inversion App Built for Apple Silicon,PetaPixel,2026-06-08T16:51:18Z,-0.3,Negative,-0.5719,Negative
AAPL,"Apple Watch SE 3, Apple Watch Ultra 3, and Apple Watch Series 11 Refurbished Versions on Sale",iLounge,2026-06-08T16:48:06Z,0.0,Neutral,0.0,Neutral
AAPL,Transcript: Chris Davis of Davis Funds,Ritholtz.com,2026-06-08T16:30:45Z,0.0,Neutral,0.0,Neutral
AAPL,"Apple stock price prediction after WWDC 2026: With Apple (AAPL) trading near its all-time high of $302.25, will AI-powered Siri drive the stock above $400?",The Times of India,2026-06-08T16:19:14Z,0.08666666666666667,Positive,0.0,Neutral
AAPL,Marvell's S&P 500 Inclusion Could Spark Fresh ETF Buying Despite Valuation Concerns,Yahoo Entertainment,2026-06-08T15:46:41Z,0.3,Positive,0.4939,Positive
AAPL,Is Apple Inc. (AAPL) A Good Stock To Buy Now?,Yahoo Entertainment,2026-06-08T15:19:57Z,0.7,Positive,0.4404,Positive
AAPL,Dell's new Nvidia RTX Spark mini PC has distinct Mac Studio vibes — and I think it could tempt buyers away from Apple given its current stock woes,TechRadar,2026-06-08T15:05:10Z,0.14545454545454545,Positive,-0.25,Negative
AAPL,"On theCUBE Pod: Snowflake, Cisco and the race to control the AI stack",SiliconANGLE News,2026-06-08T14:59:16Z,0.0,Neutral,0.0,Neutral
AAPL,Intel Foundry comeback! Is a bigger Intel stock surge ahead? INTC shares surge 9.16% today as Google’s 3 million TPU order and Nvidia testing fuel Intel’s AI revival,The Times of India,2026-06-08T14:38:43Z,0.0,Neutral,0.3595,Positive
AAPL,"Ming-Chi Kuo Warns Apple’s Siri Must Outclass Google Gemini at WWDC 2026, Not Just Catch Up After Years of Delay",Wccftech,2026-06-08T14:25:38Z,0.0,Neutral,-0.4019,Negative
AAPL,Heads up: Early Prime Day deal now live on AirPods Pro 3 down at $199 via Amazon,9to5Toys,2026-06-08T14:19:00Z,0.026936026936026935,Positive,0.1779,Positive
AAPL,Apple investors pin hopes on WWDC AI overhaul to ignite next stock surge,Macdailynews.com,2026-06-08T13:52:56Z,0.0,Neutral,0.4215,Positive
AAPL,Apple investors look for AI to power next leg of gains,Financial Post,2026-06-08T13:28:10Z,0.0,Neutral,0.34,Positive
AAPL,Apple WWDC 2026 live updates,CNBC,2026-06-08T13:24:27Z,0.13636363636363635,Positive,0.0,Neutral
AAPL,"TQQQ Turned $10,000 Into $353,789, but Friday’s 14% Crash Shows Leverage Cuts Both Ways",24/7 Wall St.,2026-06-08T13:14:23Z,0.0,Neutral,-0.7469,Negative
AAPL,Google Gemini Could Be the Ceiling on Apple's AI Ambitions,MacRumors,2026-06-08T12:31:32Z,0.0,Neutral,0.0,Neutral
AAPL,Morning Minute: Bitcoin Recovers After Fall Below $60k,Decrypt,2026-06-08T12:21:16Z,0.0,Neutral,0.0,Neutral
AAPL,"Why ROM Holders Watched $10,000 Evaporate to $8,655 When NVIDIA and Broadcom Stumbled on Friday",24/7 Wall St.,2026-06-08T12:14:57Z,0.0,Neutral,0.0,Neutral
AAPL,"Tech stocks today: OpenAI joins Anthropic, SpaceX in filing IPO paperwork, Apple stock falls after WWDC",Yahoo Entertainment,2026-06-08T12:04:20Z,0.0,Neutral,0.0,Neutral
AAPL,Tech stocks today: Apple stock falls after a long-awaited AI Siri update,Yahoo Entertainment,2026-06-08T12:04:20Z,0.0,Neutral,0.0,Neutral
AAPL,How optimistic are you about today’s new Siri announcements? [Poll],9to5Mac,2026-06-08T11:45:45Z,0.13636363636363635,Positive,0.3182,Positive
AAPL,Why the Skoda Superb Estate is the best estate car you can buy,Autocar,2026-06-08T11:30:00Z,1.0,Positive,0.8519,Positive
AAPL,Apple (AAPL) Is A Top Stock In Billionaire Ken Fisher’s Portfolio,Yahoo Entertainment,2026-06-08T10:54:04Z,0.5,Positive,0.2023,Positive
AAPL,The Stock Market's Biggest Winners And Losers Of 2026 So Far,Forbes,2026-06-08T10:30:00Z,-0.05,Negative,-0.0772,Negative
AAPL,"Gamehaus Holdings Inc. Announces Unaudited Financial Results for the Third Quarter of Fiscal 2026 Ended March 31, 2026",PRNewswire,2026-06-08T10:00:00Z,0.0,Neutral,0.0,Neutral
AAPL,Wall Street says Apple can't afford a miss on AI at this year's WWDC,Business Insider,2026-06-08T09:40:02Z,0.0,Neutral,0.1139,Positive
AAPL,"11:11 | Tensions in West Asia flare up, crude oil, Zverev wins Roland Garros, Philippines earthquake and more",CNBCTV18,2026-06-08T09:19:20Z,0.03333333333333335,Positive,-0.4019,Negative
AAPL,Mamdani’s $22 billion housing lunacy proposal will socialize the skyline,Fox News,2026-06-08T09:00:15Z,0.0,Neutral,0.0,Neutral
AAPL,"Some of the best AirPods deals of the year are live this week: Pro 3, Max 2, more",9to5Toys,2026-06-08T08:30:00Z,0.5454545454545454,Positive,0.6369,Positive
AAPL,I ate like a Boomer grandparent for a week. They’re wrong about our diets,New Zealand Herald,2026-06-08T05:00:00Z,-0.5,Negative,-0.1531,Negative
AAPL,Alberto Romero on Apple’s AI Spending,Thealgorithmicbridge.com,2026-06-08T00:55:56Z,0.0,Neutral,0.0,Neutral
AAPL,Our systems editor flew all the way to Taiwan and still couldn't get away from AI,Theregister.com,2026-06-07T23:00:00Z,0.0,Neutral,0.0,Neutral
AAPL,Anthropic wants caution but the market wants more AI,ABC News (AU),2026-06-07T18:40:06Z,0.3,Positive,0.0,Neutral
AAPL,Analyzing Clemson Tigers Football 2027 Defensive Recruiting Class,Shakinthesouthland.com,2026-06-07T17:55:00Z,0.0,Neutral,0.0258,Neutral
AAPL,SpaceX wallpapers for iPhone Starship V3 first flight,Idownloadblog.com,2026-06-07T16:16:36Z,0.25,Positive,0.0,Neutral
AAPL,Smartphone Industry Braces for Record Annual Decline as Memory Chip Shortages Deepen,Advfn.com,2026-06-07T16:11:00Z,0.0,Neutral,-0.1531,Negative
AAPL,Citi has a message for Apple stock investors,TheStreet,2026-06-07T14:37:00Z,0.0,Neutral,0.0,Neutral
AAPL,Inflation inside the electronics you buy may soon become a bit more sticky,CNBC,2026-06-07T13:59:37Z,0.5,Positive,0.0,Neutral
AAPL,How to create a Keynote presentation that would make Steve Jobs proud,Cult of Mac,2026-06-07T12:50:18Z,0.8,Positive,0.6369,Positive
AAPL,"AIQ Turned $10,000 Into $13,400 in Six Months as AI Chips Soared 34% YTD",24/7 Wall St.,2026-06-07T11:00:06Z,0.0,Neutral,0.0,Neutral
AAPL,Is Berkshire Hathaway moving away from Buffett's investment philosophy under a new CEO? Look at its deals,Livemint,2026-06-07T10:00:29Z,0.13636363636363635,Positive,0.0,Neutral
AAPL,"What to Expect in Markets This Week: May CPI Report, Updates from Tech Giants",Investopedia,2026-06-07T10:00:00Z,0.0,Neutral,0.0,Neutral
AAPL,The World’s Best Bourbon—According To The American Whiskey Commission,Forbes,2026-06-07T08:15:12Z,0.5,Positive,0.6369,Positive
AAPL,Rupee hits 96 against USD: How can falling currency impact your investments and how to protect them?,Livemint,2026-06-07T02:30:19Z,0.0,Neutral,0.25,Positive
AAPL,3x semiconductor ETF SOXL surpasses trading volume of Apple and Amazon combined,Crypto Briefing,2026-06-07T01:21:17Z,0.0,Neutral,0.1779,Positive
AAPL,"Deals: Apple Watch Series 11 for $299, AirPods from $99, $200 Off M5 MacBook Air, & More",Osxdaily.com,2026-06-06T23:23:25Z,0.5,Positive,0.0,Neutral
AAPL,Fed's Mary Daly has blunt message for AI stock investors,TheStreet,2026-06-06T19:13:00Z,0.0,Neutral,0.0,Neutral
AAPL,Andoni Iraola’s first words on AXA training centre pitch speak volumes for the players,Empire of The Kop,2026-06-06T17:55:00Z,0.25,Positive,0.0,Neutral
AAPL,Hands-on: BenQ’s new MA270S is a glossy 27-inch 5K display made for Mac,9to5Mac,2026-06-06T17:41:00Z,0.13636363636363635,Positive,0.0,Neutral
AAPL,Here’s Why Apple (AAPL) is One of the Best Big Company Stocks to Buy Right Now,Yahoo Entertainment,2026-06-06T17:24:54Z,0.42857142857142855,Positive,0.6369,Positive
AAPL,The Dow's Split Personality: Why Some Winners Soar While Others Drag Down the Dow,Barchart.com,2026-06-06T17:00:02Z,-0.12777777777777777,Negative,0.296,Positive
AAPL,SCHD’s $85 Billion Strategy Now Concentrates 41 Percent of Your Money in Just Ten Stocks,24/7 Wall St.,2026-06-06T16:11:45Z,0.0,Neutral,0.0,Neutral
AAPL,Show HN: Minimal native macOS sandbox for Claude and Codex,Github.com,2026-06-06T14:53:04Z,-0.1,Negative,0.0,Neutral
AAPL,Nvidia market cap falls below $5T amid AI sector shifts,Crypto Briefing,2026-06-06T14:50:56Z,0.0,Neutral,0.0,Neutral
AAPL,The Floppy Disk patent was granted today in 1972 — when 80KB took up 8 inches and were really floppy,Tom's Hardware UK,2026-06-06T14:45:15Z,0.2,Positive,0.25,Positive
AAPL,Warren Buffett's Berkshire triples stake in newspaper giant,TheStreet,2026-06-06T14:37:00Z,0.0,Neutral,0.0,Neutral
AAPL,I tried the SteelSeries Nimbus Cloud and feel like it’s just trying to do too much,TechRadar,2026-06-06T14:30:00Z,0.2,Positive,0.3612,Positive
AAPL,"Ferrari Unveils Its First-Ever Fully Electric Car, the Luce",My Modern Met,2026-06-06T12:50:53Z,0.0,Neutral,0.0,Neutral
AAPL,Not SpaceX: The Forgotten Satellite Stocks Quietly Plugging Into the Future of Space That Are Investible Today,24/7 Wall St.,2026-06-06T12:44:35Z,0.0,Neutral,0.1695,Positive
AAPL,"Fox News AI Newsletter: Sanders bill would seize 50% of stock in OpenAI, Anthropic for sovereign wealth fund",Fox News,2026-06-06T12:00:48Z,0.0,Neutral,0.4939,Positive
AAPL,Investors Can’t Escape AI’s Clutches,Slate Magazine,2026-06-06T10:00:00Z,0.0,Neutral,0.1779,Positive
AAPL,"Kevin-XXX/company-analyst: A skill that turns any company name into a structured fundamental analysis report — financial health, valuation, market sentiment, and a composite signal scorecard.",Github.com,2026-06-06T07:46:09Z,0.0,Neutral,0.0,Neutral
AAPL,Slate Money - The Index Fund Problemtunity,Acast.com,2026-06-06T07:00:00Z,0.0,Neutral,0.0,Neutral
AAPL,Belkin BoostCharge Pro 108W 4-Port GaN Wall Charger - $49.95 ($80 off) + $5 Delivery ($0 with $100 Spend) @ Horizon Store,Ozbargain.com.au,2026-06-06T05:14:37Z,0.0,Neutral,0.0,Neutral
MSFT,Tim Cook bows out with a very Tim Cook keynote,Mashable,2026-06-09T02:28:40Z,0.2,Positive,0.0,Neutral
MSFT,How Bill Gates' Billions Shape U.S. Medical Research,Realclearinvestigations.com,2026-06-09T02:08:16Z,0.0,Neutral,0.0,Neutral
MSFT,OpenAI joins rival Anthropic in race to Wall Street,The Times of India,2026-06-09T01:18:20Z,0.0,Neutral,0.0,Neutral
MSFT,OpenAI files for US IPO after Anthropic as AI giants head to public markets,The Times of India,2026-06-09T01:17:50Z,0.0,Neutral,0.0,Neutral
MSFT,"OpenAI IPO: ChatGPT maker files for US Stock Market initial public offering after Anthropic, SpaceX",The Times of India,2026-06-09T00:10:00Z,0.0,Neutral,0.0,Neutral
MSFT,Tech giant OpenAI files for US initial public offering,Al Jazeera English,2026-06-08T22:23:40Z,0.0,Neutral,0.0,Neutral
MSFT,Why Patagonia Filed A Trademark Infringement Lawsuit Against ‘Pattie Gonia’,Forbes,2026-06-08T22:14:34Z,0.0,Neutral,-0.6124,Negative
MSFT,OpenAI Files For U.S. IPO After Anthropic As AI Giants Head To Public Markets,HuffPost,2026-06-08T22:00:58Z,0.0,Neutral,0.0,Neutral
MSFT,OpenAI Confidentially Files for IPO on the Heels of SpaceX and Anthropic,Wired,2026-06-08T21:31:58Z,0.0,Neutral,0.0,Neutral
MSFT,OpenAI files for US IPO after Anthropic as AI giants head to public markets,CNA,2026-06-08T21:17:00Z,0.0,Neutral,0.0,Neutral
MSFT,Apple reveals long-delayed Siri AI makeover at Worldwide Developers Conference,New York Post,2026-06-08T18:51:59Z,0.0,Neutral,0.0,Neutral
MSFT,SpaceX’s $75 billion IPO is well oversubscribed as order books close ahead of Wednesday pricing,The Next Web,2026-06-08T17:39:38Z,0.0,Neutral,0.2732,Positive
MSFT,The gravity of the SpaceX IPO,Freerepublic.com,2026-06-08T17:23:12Z,0.0,Neutral,0.0,Neutral
MSFT,This Stock Is My Biggest Bet For June,24/7 Wall St.,2026-06-08T16:25:23Z,0.0,Neutral,0.0,Neutral
MSFT,"Apple stock price prediction after WWDC 2026: With Apple (AAPL) trading near its all-time high of $302.25, will AI-powered Siri drive the stock above $400?",The Times of India,2026-06-08T16:19:14Z,0.08666666666666667,Positive,0.0,Neutral
MSFT,Get Ready for Phase 2 of the AI Era. ChatGPT is getting its “Biggest Update” Yet,24/7 Wall St.,2026-06-08T16:17:56Z,0.2,Positive,0.3612,Positive
MSFT,"Trump Administration Eyes Equity Stake in OpenAI, Aligning with Push for Public Share in AI Gains - The Manhattan",Themanhattan.press,2026-06-08T15:54:43Z,0.0,Neutral,0.5574,Positive
MSFT,Marvell's S&P 500 Inclusion Could Spark Fresh ETF Buying Despite Valuation Concerns,Yahoo Entertainment,2026-06-08T15:46:41Z,0.3,Positive,0.4939,Positive
MSFT,AI Is Slowing Down,Wheresyoured.at,2026-06-08T15:46:37Z,-0.15555555555555556,Negative,0.0,Neutral
MSFT,Nebius Is Up Nearly 175% This Year—Here's What's Driving the Latest Run,MarketBeat,2026-06-08T15:45:00Z,0.3,Positive,0.0,Neutral
MSFT,Is Apple Inc. (AAPL) A Good Stock To Buy Now?,Yahoo Entertainment,2026-06-08T15:19:57Z,0.7,Positive,0.4404,Positive
MSFT,3 Energy Stocks Built for the AI Power Boom—And Beyond,MarketBeat,2026-06-08T15:10:00Z,0.0,Neutral,0.2732,Positive
MSFT,"Why is the US stock market rallying big today? Dow Jones, S&P 500 and Nasdaq surge on AI boom — Nvidia and Intel jump as Nasdaq significantly outperformed both the Dow and S&P",The Times of India,2026-06-08T15:07:20Z,0.1875,Positive,0.0,Neutral
MSFT,(VIDEO) Nintendo Direct June 9 2026: Switch 2 Focus and Major Game Reveals Expected,Ibtimes.com.au,2026-06-08T15:07:19Z,-0.084375,Negative,0.0,Neutral
MSFT,Dell's new Nvidia RTX Spark mini PC has distinct Mac Studio vibes — and I think it could tempt buyers away from Apple given its current stock woes,TechRadar,2026-06-08T15:05:10Z,0.14545454545454545,Positive,-0.25,Negative
MSFT,"On theCUBE Pod: Snowflake, Cisco and the race to control the AI stack",SiliconANGLE News,2026-06-08T14:59:16Z,0.0,Neutral,0.0,Neutral
MSFT,Alphabet GOOG Stock 2026 Outlook: Strong AI Momentum Makes It a Buy for Long-Term Investors,Ibtimes.com.au,2026-06-08T14:50:30Z,0.43333333333333335,Positive,0.5106,Positive
MSFT,"Buy, Sell, or Hold: CoreWeave at $100",24/7 Wall St.,2026-06-08T14:15:11Z,0.0,Neutral,0.0,Neutral
MSFT,"Man Snaps Random Picture On The Way To Meet GF, It Ends Up Being “The Most Viewed Photo Ever”",Boredpanda.com,2026-06-08T14:01:13Z,0.0,Neutral,0.0,Neutral
MSFT,RNA Polymerase III subunit Polr3a is required for craniofacial cartilage and bone development in zebrafish,Plos.org,2026-06-08T14:00:00Z,0.0,Neutral,0.0,Neutral
MSFT,Why Microsoft Stock Surged 10.4% Last Month But Is Sinking in June,Yahoo Entertainment,2026-06-08T13:28:26Z,0.0,Neutral,0.0,Neutral
MSFT,"⚡ Weekly Recap: Instagram Account Hacks, Android Zero-Day, GitHub Worm and More",Internet,2026-06-08T13:18:57Z,0.5,Positive,0.0,Neutral
MSFT,"TQQQ Turned $10,000 Into $353,789, but Friday’s 14% Crash Shows Leverage Cuts Both Ways",24/7 Wall St.,2026-06-08T13:14:23Z,0.0,Neutral,-0.7469,Negative
MSFT,JPMorgan Sees Qualcomm (QCOM) Investor Day as Potential AI Growth Catalyst,Yahoo Entertainment,2026-06-08T13:09:02Z,0.0,Neutral,0.3818,Positive
MSFT,Reddit’s (RDDT) AI Search Push and Ad Momentum Support Bullish Wall Street View,Yahoo Entertainment,2026-06-08T13:08:55Z,0.0,Neutral,0.4019,Positive
MSFT,"Elon Musk Net Worth: From $788,800,000,000 today to a possible $1,000,000,000,000 after SpaceX IPO— How much would each of his 14 children get?",The Times of India,2026-06-08T12:59:25Z,0.125,Positive,0.2263,Positive
MSFT,Intel (INTC) and Hitachi Team Up to Accelerate Physical AI Across Industries,Yahoo Entertainment,2026-06-08T12:50:46Z,0.0,Neutral,0.0,Neutral
MSFT,HSBC Raises Broadcom (AVGO) Price Target on AI ASIC Growth Outlook,Yahoo Entertainment,2026-06-08T12:49:43Z,0.0,Neutral,0.3818,Positive
MSFT,SpaceX Has a Plan for AI That Sounds Like Pure Science Fiction. How It Impacts Your Wealth,24/7 Wall St.,2026-06-08T12:44:37Z,0.21428571428571427,Positive,0.6908,Positive
MSFT,"Why ROM Holders Watched $10,000 Evaporate to $8,655 When NVIDIA and Broadcom Stumbled on Friday",24/7 Wall St.,2026-06-08T12:14:57Z,0.0,Neutral,0.0,Neutral
MSFT,Silverfort brings runtime identity controls to Microsoft Copilot Studio agents,SiliconANGLE News,2026-06-08T12:00:55Z,0.0,Neutral,0.0,Neutral
MSFT,The first alien intelligence may not be alive,The Space Review,2026-06-08T11:57:00Z,0.03333333333333333,Positive,0.2302,Positive
MSFT,"Vulnerability Summary for the Week of June 1, 2026",Cisa.gov,2026-06-08T11:15:41Z,0.0,Neutral,-0.2263,Negative
MSFT,Microsoft (MSFT) Is A Top AI Stock In Billionaire Ken Fisher’s Portfolio,Yahoo Entertainment,2026-06-08T11:07:41Z,0.5,Positive,0.2023,Positive
MSFT,Podcast: From MCP and Vibe Coding to Harness Engineering: How Did AI Native Engineering Evolve in One Year,InfoQ.com,2026-06-08T11:00:00Z,0.0,Neutral,0.0,Neutral
MSFT,Futurum CEO Daniel Newman Drops Reality Check On AI's Trillion-Dollar Bet: 'We've Barely Scratched The Surface...',Yahoo Entertainment,2026-06-08T10:46:05Z,0.05,Positive,0.0,Neutral
MSFT,Data Centers Are Plugging a Big Hole in the U.S. Construction Industry,Commercial Observer,2026-06-08T10:30:15Z,0.0,Neutral,0.0,Neutral
MSFT,The Stock Market's Biggest Winners And Losers Of 2026 So Far,Forbes,2026-06-08T10:30:00Z,-0.05,Negative,-0.0772,Negative
MSFT,"SOXQ Semiconductor ETF Surges 181.74% as AI Chip Boom Lifts NVIDIA, Broadcom, AMD",24/7 Wall St.,2026-06-08T09:30:49Z,0.0,Neutral,0.0,Neutral
MSFT,"11:11 | Tensions in West Asia flare up, crude oil, Zverev wins Roland Garros, Philippines earthquake and more",CNBCTV18,2026-06-08T09:19:20Z,0.03333333333333335,Positive,-0.4019,Negative
MSFT,"Billionaire David Tepper Sold Most of Appaloosa's Position in Microsoft and Initiated a New Stake in an Artificial Intelligence (AI) Memory Stock Up Over 4,100% in the Past Year",Yahoo Entertainment,2026-06-08T08:25:00Z,-0.053409090909090906,Negative,0.4767,Positive
MSFT,‘Yet another way in which 2026 is looking like 1999’: Top analyst fears bubble popping with investors and Wall Street out over their skis,Yahoo Entertainment,2026-06-08T06:00:00Z,0.5,Positive,0.128,Positive
MSFT,‘Yet another way in which 2026 is looking like 1999’: Top analyst fears bubble popping with investors and Wall Street out over their skis,Fortune,2026-06-08T06:00:00Z,0.5,Positive,0.128,Positive
MSFT,"Why one fund manager is 'nervous' about SpaceX list, but you'll probably get a slice anyway",RNZ,2026-06-08T03:09:15Z,0.0,Neutral,0.0,Neutral
MSFT,Alberto Romero on Apple’s AI Spending,Thealgorithmicbridge.com,2026-06-08T00:55:56Z,0.0,Neutral,0.0,Neutral
MSFT,Our systems editor flew all the way to Taiwan and still couldn't get away from AI,Theregister.com,2026-06-07T23:00:00Z,0.0,Neutral,0.0,Neutral
MSFT,"I created a complex presentation using Claude Design, Copilot in PowerPoint, and Gemini in Google Slides – only one of them did a professional job",XDA Developers,2026-06-07T22:00:24Z,-0.06666666666666667,Negative,0.25,Positive
MSFT,Xbox Goes Back to Green for 25th Anniversary Editions,CNET,2026-06-07T21:45:46Z,-0.1,Negative,0.0,Neutral
MSFT,"NVDL Collapsed 12% in a Single Day as Nvidia Lost $279 Billion, Exposing How Leverage Compounds on Bad Tape",24/7 Wall St.,2026-06-07T19:15:11Z,-0.3857142857142856,Negative,-0.8402,Negative
MSFT,Anthropic wants caution but the market wants more AI,ABC News (AU),2026-06-07T18:40:06Z,0.3,Positive,0.0,Neutral
MSFT,SpaceX IPO: Elon Musk's AI ambitions fueling space data centers & trillionaire dreams,The Times of India,2026-06-07T18:07:33Z,0.0,Neutral,0.4019,Positive
MSFT,Netflix’s Underperforming Stock Needs a New Story. It Can’t Be AI.,Barchart.com,2026-06-07T18:00:02Z,0.13636363636363635,Positive,0.0,Neutral
MSFT,"Trump's New AI Clock Starts Ticking: Will Microsoft, Oracle Or Palantir Become 'Trusted Partners'?",Yahoo Entertainment,2026-06-07T17:31:10Z,0.13636363636363635,Positive,0.4767,Positive
MSFT,"Snowflake, Databricks and the model makers: The battle for the agentic client and AI back end",SiliconANGLE News,2026-06-07T16:39:01Z,0.0,Neutral,-0.3818,Negative
MSFT,Bill Maher’s New Rule: How the kids must “fix” AI,Whyevolutionistrue.com,2026-06-07T16:15:27Z,0.13636363636363635,Positive,0.0,Neutral
MSFT,Is AECOM (ACM) A Good Stock To Buy Now?,Yahoo Entertainment,2026-06-07T14:46:43Z,0.7,Positive,0.4404,Positive
MSFT,Security Affairs newsletter Round 580 by Pierluigi Paganini – INTERNATIONAL EDITION,Securityaffairs.com,2026-06-07T14:39:23Z,-0.1,Negative,0.34,Positive
MSFT,Microsoft Announces Majorana 2 Quantum Chip as Wedbush Calls It Another ‘Validation’ for the Industry,Barchart.com,2026-06-07T14:15:02Z,0.0,Neutral,0.0,Neutral
MSFT,"Donald Trump considers government stake in leading AI companies, White House meeting planned",Crypto Briefing,2026-06-07T13:57:56Z,0.0,Neutral,0.0,Neutral
MSFT,"Dear Future ERock Stock Fans, Mark Your Calendars for June 10",Barchart.com,2026-06-07T13:45:02Z,0.0,Neutral,0.3818,Positive
MSFT,The business of AI is facing 4 harsh realities,Axios,2026-06-07T12:42:03Z,-0.2,Negative,-0.4404,Negative
MSFT,"AIQ Turned $10,000 Into $13,400 in Six Months as AI Chips Soared 34% YTD",24/7 Wall St.,2026-06-07T11:00:06Z,0.0,Neutral,0.0,Neutral
MSFT,"Amazon, Microsoft fare better than most in tech stock sell-off spree - The Seattle Times",Slashdot.org,2026-06-07T08:32:54Z,0.5,Positive,0.5574,Positive
MSFT,Meta’s massive stock sale plans spark a chain reaction across Big Tech,Crypto Briefing,2026-06-07T07:13:35Z,0.0,Neutral,0.2263,Positive
MSFT,Fed's Mary Daly has blunt message for AI stock investors,TheStreet,2026-06-06T19:13:00Z,0.0,Neutral,0.0,Neutral
MSFT,Wells Fargo Raises PT on Microsoft (MSFT) Stock,Yahoo Entertainment,2026-06-06T17:24:23Z,0.0,Neutral,0.25,Positive
MSFT,The Dow's Split Personality: Why Some Winners Soar While Others Drag Down the Dow,Barchart.com,2026-06-06T17:00:02Z,-0.12777777777777777,Negative,0.296,Positive
